Con,Contp,PP,PPName,Reg,AgtId,Ver,Agt,Dat,Status,Lgt,N_characters,Agtp,Stage,StageSub,Part,ThrdPart,OthAgr,Loc1ISO,Loc2ISO,Loc1GWNO,Loc2GWNO,UcdpCon,UcdpAgr,PamAgr,CowWar,GCh,GChRhet,GChAntid,GChSubs,GChOth,GDis,GDisRhet,GDisAntid,GDisSubs,GDisOth,GAge,GAgeRhet,GAgeAntid,GAgeSubs,GAgeOth,GMig,GMigRhet,GMigAntid,GMigSubs,GMigOth,GRa,GRaRhet,GRaAntid,GRaSubs,GRaOth,GRe,GReRhet,GReAntid,GReSubs,GReOth,GInd,GIndRhet,GIndAntid,GIndSubs,GIndOth,GOth,GOthRhet,GOthAntid,GOthSubs,GOthOth,GRef,GRefRhet,GRefSubs,GRefOth,GSoc,GSocRhet,GSocAntid,GSocSubs,GSocOth,GeWom,GeMe,GeMeNu,GeMeOth,GeLgbti,GeLgbtiPos,GeLgbtiNeg,GeFa,StDef,StGen,StCon,StSd,StRef,StSym,StInd,StUni,StBor,StXbor,Pol,PolGen,PolNewInd,PolNewTemp,ConRen,Cons,Ele,ElecComm,PolPar,PolParTrans,PolParOth,Civso,Tral,Pubad,Polps,PpsSt,PpsSub,PpsEx,PpsOro,PpsOthPr,PpsVet,PpsAut,PpsInt,PpsOth,Terps,TpsSub,TpsLoc,TpsAut,TpsOth,Eps,EpsRes,EpsFis,EpsOth,Mps,MpsMe,MpsJt,MpsPro,MpsOth,HrGen,EqGen,HrDem,Prot,ProtCiv,ProtGrp,ProtLgl,ProtOth,HrFra,HrfSp,HrfBor,HrfTinc,HrfOth,HrCp,CprLife,CprTort,CprEq,CprSlav,CprLib,CprDet,CprFmov,CprFspe,CprFass,CprTria,CprPriv,CprVote,CprReli,CprOth,HrSec,SerProp,SerWork,SerHeal,SerEdu,SerStdl,SerShel,SerSs,SerCult,SerOth,HrNi,HrNiMe,HrNiNe,HrNiOth,HrIi,HrIiMon,HrIiBod,HrIiOth,HrMob,HrDet,Med,MedGov,MedSubs,MedLog,MedOth,HrCit,CitGen,CitRights,CitDef,CitOth,JusCr,JusCrSp,JusCrSys,JusCrPow,JusEm,JusJu,JusPri,JusTra,Dev,DevSoc,DevHum,DevInfra,NEC,NatRes,IntFu,Bus,Tax,TaxPo,TaxRef,TaxOth,Ban,CenBan,BanPers,BanInt,BanXb,LaRef,LaRefMan,LaRefRet,LaRefOth,LaNom,LaCH,LaCHTa,LaCHIt,LaCHPro,LaCHOth,LaEn,Wat,SsrGua,Ce,CeProv,CeGen,SsrPol,SsrArm,SsrDdr,DdrDemil,DdrProg,SsrInt,SsrPsf,SsrFf,Cor,SsrCrOcr,SsrDrugs,Terr,TjGen,TjAm,TjAmPro,TjSan,TjPower,TjAmBan,TjCou,TjJaNc,TjJaIc,TjMech,TjPrire,TjVet,TjVic,TjMis,TjRep,TjRSym,TjRMa,TjNR,ImUN,ImOth,ImRef,ImPK,ImE,ImSrc
Colombia,Government,144,"Colombia VI - Government-ELN post-2015 process",Americas,2045,2,"Joint Announcement by the National Government and the National Liberation Army (ELN)",2017-10-24,"Multiparty signed/agreed",2,4138,Intra,Pre,Proc,"Government of Colombia and ELN",,,COL,,100,,289,NA,NA,856,0,0,0,0,0,0,0,0,0,0,0,0,0,0,0,0,0,0,0,0,0,0,0,0,0,0,0,0,0,0,0,0,0,0,0,0,0,0,0,0,0,0,0,0,0,0,0,0,0,0,0,0,0,0,0,0,0,0,0,0,0,0,0,0,0,0,0,0,0,0,0,0,0,0,0,0,0,0,0,0,0,0,0,0,0,0,0,0,0,0,0,0,0,0,0,0,0,0,0,0,0,0,0,0,0,0,0,0,0,0,0,0,0,0,0,0,0,0,0,0,0,0,0,0,0,0,0,0,0,0,0,0,0,0,0,0,0,0,0,0,0,0,0,0,0,0,0,0,0,0,0,0,0,0,0,0,0,0,0,0,0,0,0,0,0,0,0,0,0,0,0,0,0,0,0,0,0,0,0,0,0,0,0,0,0,0,0,0,0,0,0,0,0,0,0,0,0,0,0,0,0,1,0,1,0,0,0,0,0,0,1,0,0,0,0,0,0,0,0,0,0,0,0,0,0,0,0,0,0,0,0,0,0,0,0,0,0,0,1,1
Colombia,Government,144,"Colombia VI - Government-ELN post-2015 process",Americas,2043,2,"Comunicado Conjunto 5: Entre El Gobierno Nacional Y El de Liberacion Nacional (ELN) JOINT ANNOUNCEMENT BY THE NATIONAL GOVERNMENT AND THE NATIONAL LIBERATION ARMY (ELN)APPLICATION TO THE SECURITY COUNCIL ON THE UNITED NATIONS’ PARTICIPATION IN THE VERIFICATION AND IMPLEMENTATION OF THE BILATERAL, TEMPORARY AND NATIONAL CEASEFIRE (CFBTN) AGREED BETWEEN THE GOVERNMENT OF COLOMBIA AND THE NATIONAL LIBERATION ARMY (ELN)
",2017-09-24,"Multiparty signed/agreed",2,4464,Intra,Pre,,,,,COL,,100,,289,NA,NA,856,0,0,0,0,0,0,0,0,0,0,0,0,0,0,0,0,0,0,0,0,0,0,0,0,0,0,0,0,0,0,0,0,0,0,0,0,0,0,0,0,0,0,0,0,0,0,0,0,0,0,0,0,0,0,0,0,0,0,0,0,0,0,0,0,0,0,0,0,0,0,0,0,0,0,0,0,0,0,1,0,0,0,0,0,0,0,0,0,0,0,0,0,0,0,0,0,0,0,0,0,0,0,0,0,0,0,0,0,0,0,0,0,0,0,0,0,0,0,0,0,0,0,0,0,0,0,0,0,0,0,0,0,0,0,0,0,0,0,0,0,0,0,0,0,0,0,0,0,0,0,0,0,0,0,0,0,0,0,0,0,0,0,0,0,0,0,0,0,0,0,0,0,0,0,0,0,0,0,0,0,0,0,0,0,0,0,0,0,0,0,0,0,0,0,0,0,0,0,0,0,0,2,0,1,0,0,0,0,0,0,1,0,0,0,0,0,0,0,0,0,0,0,0,0,0,0,0,0,0,0,0,0,0,0,0,0,0,0,1,1
Colombia,Government,144,"Colombia VI - Government-ELN post-2015 process",Americas,1890,2,"Comunicado Conjunto 4: Acuerdo de Quito ",2017-09-04,"Multiparty signed/agreed",1,1453,Intra,Cea,CeaMix,"By the Head of the Delegation of the Government, Juan Camilo Restrepo.
By the Head of the Delegation of the National Liberation Army, Pablo Beltran.",,,COL,,100,,289,NA,NA,856,0,0,0,0,0,0,0,0,0,0,0,0,0,0,0,0,0,0,0,0,0,0,0,0,0,0,0,0,0,0,0,0,0,0,0,0,0,0,0,0,0,0,0,0,0,0,0,0,0,0,0,0,0,0,0,0,0,0,0,0,0,0,0,0,0,0,0,0,0,0,0,0,0,0,0,0,0,0,0,0,0,0,0,0,0,0,0,0,0,0,0,0,0,0,0,0,0,0,0,0,0,0,0,0,0,0,0,0,0,0,0,0,0,0,0,0,0,0,0,0,0,0,0,0,0,0,0,0,0,0,0,0,0,0,0,0,0,0,0,0,0,0,0,0,0,0,0,0,0,0,0,0,0,0,0,0,0,0,0,0,0,0,0,0,0,0,0,0,0,0,0,1,0,1,0,0,0,0,0,0,0,0,0,0,0,0,0,0,0,0,0,0,0,0,0,0,0,0,0,0,0,1,0,1,0,0,0,0,0,0,1,0,0,0,0,0,0,0,0,0,0,0,0,0,0,0,0,0,0,0,0,0,0,0,0,0,0,0,1,1
Colombia,Government,144,"Colombia VI - Government-ELN post-2015 process",Americas,1937,2,"Comunicado Conjunto 3",2017-06-06,"Multiparty signed/agreed",1,1695,Intra,Pre,Proc,"National Government of Colombia and the National Liberation Army (ELN) ",,,COL,,100,,289,NA,NA,856,0,0,0,0,0,0,0,0,0,0,0,0,0,0,0,0,0,0,0,0,0,0,0,0,0,0,0,0,0,0,0,0,0,0,0,0,0,0,0,0,0,0,0,0,0,0,0,0,0,0,0,0,0,0,0,0,0,0,0,0,0,0,0,0,0,0,0,0,0,0,0,0,0,0,0,0,0,0,0,0,0,0,0,0,0,0,0,0,0,0,0,0,0,0,0,0,0,0,0,0,0,0,0,0,0,0,0,0,0,0,0,0,0,0,0,0,0,0,0,0,0,0,0,0,0,0,0,0,0,0,0,0,0,0,0,0,0,0,0,0,0,0,0,0,0,0,0,0,0,0,0,0,0,2,0,0,0,1,0,0,0,0,0,0,0,0,0,0,0,0,0,0,0,0,0,0,0,1,0,0,0,0,0,0,0,0,0,0,0,0,0,0,0,0,0,0,0,0,0,0,0,0,0,0,0,0,0,0,0,0,1,0,0,0,0,0,0,0,0,0,0,0,0,0,0,0,0,0,0,0,0,0,0,0,0,0,0,0,1,1
Colombia,Government,144,"Colombia VI - Government-ELN post-2015 process",Americas,1936,2,"Comunicado Conjunto 2",2017-04-06,"Multiparty signed/agreed",1,1561,Intra,Pre,Conf,"National Government and the National Liberation Army",,,COL,,100,,289,NA,NA,856,0,0,0,0,0,0,0,0,0,0,0,0,0,0,0,0,0,0,0,0,0,0,0,0,0,0,0,0,0,0,0,0,0,0,0,0,0,0,0,0,0,0,0,0,0,0,0,0,0,0,0,0,0,0,0,0,0,0,0,0,0,0,0,0,0,0,0,0,0,0,0,0,0,0,0,0,0,0,0,0,0,0,0,0,0,0,0,0,0,0,0,0,0,0,0,0,0,0,0,0,0,0,0,0,0,0,0,0,0,0,0,0,0,1,0,0,1,0,0,0,0,0,0,0,0,0,0,0,0,0,0,0,0,0,0,0,0,0,0,0,0,0,0,0,0,0,0,0,0,0,0,0,0,0,0,0,0,0,0,0,0,0,0,0,0,0,0,0,0,0,0,1,0,1,0,0,0,0,0,0,0,0,0,0,0,0,0,0,0,0,0,0,0,0,0,0,0,0,0,0,0,0,0,0,0,0,0,0,0,0,0,0,0,0,0,0,0,0,0,0,0,0,0,0,0,0,0,0,0,0,0,0,0,0,0,0,0,0,1,1
Colombia,Government,101,"Colombia V - Santos",Americas,1845,2,"Final Agreement to End the Armed Conflict and Build a Stable and Lasting Peace",2016-11-24,"Multiparty signed/agreed",323,908459,Intra,SubComp,FrAg,"National Government of Colombia
FARC-EP (Fuerzas Armadas Revolucionarias de Colombia - Ejército del Pueblo)","Republic of Cuba and from the Kingdom of Norway
Bolivarian Republic of Venezuela and the Republic of Chile ","Joint Communiqué No. 70 of 15 May 2016
General Agreement to End the Armed Conflict and Build a Stable and Lasting Peace signed in Havana on 26 August 2012
AGREEMENT OF 7 NOVEMBER 2016
AGREEMENT OF 9 NOVEMBER 2016
SPECIAL IMPLEMENTATION AGREEMENT TO SELECT THE EXECUTIVE SECRETARY OF THE SPECIAL JURISDICTION FOR PEACE AND ENSURE ITS DUE OPERATION
AGREEMENT TO FACILITATE THE FULFILMENT OF THE TIMETABLE FOR THE PROCESS OF LAYING DOWN OF ARMS ESTABLISHED BY MEANS OF AN AGREEMENT OF 23 JUNE 2016 (pp 297-299)
General Agreement to End the Armed Conflict and Build a Stable and Lasting Peace, 26 August 2012
Final Agreement to End the Armed Conflict and Build a Stable and Lasting Peace; 24 August 2016
Bilateral and Definitive Ceasefire and Cessation of Hostilities and Laying down of Arms and Security Guarantees, June 23 2016
",COL,,100,,289,1487,NA,856,3,1,1,1,0,3,1,1,1,0,3,1,1,1,0,0,0,0,0,0,3,1,1,1,0,3,1,1,1,0,3,1,0,1,0,3,1,1,1,0,2,1,1,0,2,1,0,1,0,1,1,1,1,1,1,0,1,1,1,1,1,0,0,0,0,0,0,3,0,1,0,3,3,2,3,3,1,1,1,1,3,2,0,0,0,1,0,0,0,0,1,3,0,0,0,1,2,0,1,0,0,0,0,0,0,1,3,3,3,0,0,0,1,3,0,1,1,0,1,1,0,0,0,1,0,1,1,1,0,0,1,1,1,1,1,1,0,1,1,1,0,1,1,2,1,0,0,2,1,0,0,1,0,3,0,1,0,1,1,0,0,1,0,1,1,1,1,0,1,1,1,3,1,0,0,1,1,1,3,2,1,1,0,0,0,0,0,0,1,1,1,0,0,1,1,1,0,0,1,1,1,3,1,0,3,3,3,1,1,1,1,0,3,3,3,0,3,3,1,0,1,0,3,1,0,3,3,0,3,3,3,1,1,3,0,0,1,1,1,1
Colombia,Inter-group,101,"Colombia V - Santos",Americas,2127,2,"FARC Letter To Christians and Anyone Who Professes a Religion",2016-10-29,"Unilateral document",1,2808,Intra,Imp,ExtSub,"Signed: 
FARC ",,,COL,,100,,289,NA,NA,856,2,0,0,1,0,0,0,0,0,0,0,0,0,0,0,0,0,0,0,0,0,0,0,0,0,3,0,0,1,0,0,0,0,0,0,2,0,0,1,0,0,0,0,0,0,0,0,0,0,1,0,0,0,0,0,0,1,0,0,0,0,0,0,0,0,0,0,0,0,0,0,0,0,0,0,0,0,0,1,1,0,0,0,0,0,0,0,0,0,0,0,0,0,0,0,0,0,0,0,0,0,0,0,0,0,0,0,0,0,0,0,0,0,0,0,0,0,0,1,0,0,0,0,0,0,0,0,0,0,0,0,1,0,1,0,0,0,1,0,0,0,0,0,0,0,0,0,0,0,0,0,0,0,0,0,0,0,0,0,0,0,0,0,0,0,0,0,0,0,0,0,0,0,0,0,0,0,0,0,0,0,0,0,0,0,0,0,0,0,0,0,0,0,0,0,0,0,0,0,0,0,0,0,0,0,0,0,0,0,0,0,0,0,0,0,0,0,0,0,0,0,0,0,0,0,0,0,0,1,0,0,0,0,1,0,0,0,0,1,1
Colombia,Government/territory,101,"Colombia V - Santos",Americas,2068,2,"Joint Communique: Final Agreement, Plebiscite and Ceasefire",2016-10-07,"Multiparty signed/agreed",2,3973,Intra,Imp,,,,"Page 1,

…

2. We reiterate the commitment undertaken by the President of the Republic and the Commander of the FARC – EP to maintain the Final and Bilateral Ceasefire and End of the Hostilities decreed this past August 29, and the monitoring and verification in charge of the tripartite mechanism. As well as the guarantees for the security and protection of the communities in their territories, as determined by the parties in the Protocol.",COL,,100,,289,NA,NA,856,1,0,0,1,0,0,0,0,0,0,0,0,0,0,0,0,0,0,0,0,0,0,0,0,0,0,0,0,0,0,0,0,0,0,0,0,0,0,0,0,0,0,0,0,0,0,0,0,0,0,0,0,0,0,0,0,0,0,0,0,0,0,0,0,0,0,0,0,0,0,0,0,0,0,0,0,0,0,1,0,0,0,0,0,0,0,0,0,0,0,0,0,0,0,0,0,0,0,0,0,0,0,0,0,0,0,0,0,0,0,0,0,0,0,0,0,0,0,0,0,0,0,0,0,0,0,0,0,0,0,0,0,0,0,0,0,0,0,0,0,0,0,0,0,0,0,0,0,0,0,0,0,0,0,0,0,0,0,0,0,0,0,0,0,0,0,0,0,1,1,0,1,0,1,0,0,0,0,0,0,0,0,0,0,0,0,0,0,0,0,0,0,0,0,0,0,0,0,1,0,0,2,0,1,0,0,1,1,0,0,0,0,0,0,1,0,0,0,0,0,0,0,0,0,0,0,0,0,0,0,0,0,0,0,0,0,1,1,1,1
Colombia,Government,101,"Colombia V - Santos",Americas,1821,2,"Joint Communique #97",2016-09-06,"Multiparty signed/agreed",2,3358,Intra,Imp,ImpMod,"Government of Colombia
FARC-EP",,"Communique #96
Communique #70",COL,,100,,289,NA,NA,856,3,0,0,1,0,0,0,0,0,0,0,0,0,0,0,0,0,0,0,0,0,0,0,0,0,0,0,0,0,0,0,0,0,0,0,0,0,0,0,0,2,0,1,0,1,1,0,0,0,1,1,0,1,0,0,0,1,0,0,0,0,0,0,0,0,0,0,0,0,0,0,0,0,0,0,0,0,0,1,0,0,0,0,0,0,0,0,0,0,0,0,0,0,0,0,0,0,0,0,0,0,0,0,0,0,0,0,0,0,0,0,0,0,0,0,0,0,0,0,0,0,0,0,0,0,0,0,0,0,0,0,0,0,0,0,0,0,0,0,0,0,0,0,0,0,0,0,0,0,0,0,0,0,1,0,1,0,0,0,0,0,0,0,0,0,0,0,0,0,0,0,1,0,1,0,0,0,0,0,0,0,0,0,0,0,0,0,0,0,0,0,0,0,0,0,0,0,0,0,0,0,0,0,0,0,0,0,0,0,0,0,0,0,0,0,0,0,0,0,0,0,0,0,0,0,0,0,0,0,0,0,0,0,0,0,0,0,0,1,1
Colombia,Government,101,"Colombia V - Santos",Americas,2065,2,"Joint Communique #96",2016-09-02,"Multiparty signed/agreed",1,809,Intra,Imp,ImpMod,"Unsigned - but mentioned in the text 
The Government of Colombia 
FARC ",,,COL,,100,,289,NA,NA,856,2,0,0,1,0,0,0,0,0,0,0,0,0,0,0,0,0,0,0,0,0,0,0,0,0,0,0,0,0,0,0,0,0,0,0,0,0,0,0,0,0,0,0,0,0,0,0,0,0,1,1,0,1,0,0,0,0,0,0,0,0,0,0,0,0,0,0,0,0,0,0,0,0,0,0,0,0,0,1,0,0,0,0,0,0,0,0,0,0,0,0,0,0,0,0,0,0,0,0,0,0,0,0,0,0,0,0,0,0,0,0,0,0,0,0,0,0,0,0,0,0,0,0,0,0,0,0,0,0,0,0,0,0,0,0,0,0,0,0,0,0,0,0,0,0,0,0,0,0,0,0,0,0,0,0,0,0,0,0,0,0,0,0,0,0,0,0,0,0,0,0,0,0,0,0,0,0,1,0,0,0,0,0,0,0,0,0,0,0,0,0,0,0,0,0,0,0,0,0,0,0,0,0,0,0,0,0,0,0,0,0,0,0,0,0,0,0,0,0,0,0,0,0,0,0,0,0,0,0,0,0,0,0,0,0,0,0,0,0,1
Colombia,Government,101,"Colombia V - Santos",Americas,1796,2,"Agreement on security guarantees and the fight against criminal organisations responsible for killings and massacres, or that infringe against defenders of human rights, social movements or political movements, including the criminal organisations that have been named successors to paramilitary groups and their support networks, and the persecution of criminal behavior that threatens the implementation of the agreements and the building of peace",2016-06-23,"Multiparty signed/agreed",18,63723,Intra,SubPar,,"By the National Government: Humberto de la Calle
Head of the National Government Peace Delegation

By the FARC -EP: Iván Márquez
Head of the FARC-EP Peace Delegation

","By the Guarantor Countries:
By the Republic of Cuba
By the Kingdom of Norway

By the accompanying countries:
By the Bolivarian Republic of Venezuela
By the Republic of Chile
","- General Agreement for the Termination of the Conflict 
- Political Participation
- Comprehensive Security System for Political Activity",COL,,100,,289,NA,NA,856,3,0,0,1,0,1,1,0,0,0,0,0,0,0,0,0,0,0,0,0,1,1,0,0,0,1,1,0,0,0,3,1,0,1,0,3,1,0,1,0,0,0,0,0,0,0,0,0,0,1,1,1,0,1,1,0,1,0,0,0,0,0,0,0,0,0,0,3,1,0,0,1,2,0,0,3,1,0,1,0,1,0,0,0,0,0,0,0,0,0,0,0,0,0,0,0,0,0,0,0,0,0,0,0,0,1,0,3,1,0,0,0,1,2,0,0,1,0,1,1,0,0,0,1,0,1,0,0,1,0,0,0,0,1,0,1,0,0,0,0,0,0,0,3,0,1,0,0,0,0,0,1,0,2,0,1,0,0,2,0,1,0,0,1,0,1,0,0,1,0,0,0,0,0,0,0,1,1,1,1,0,1,0,0,0,0,0,0,0,0,0,0,0,0,0,0,0,0,0,0,1,0,0,0,3,0,3,0,1,2,1,0,3,3,3,0,2,2,0,1,0,0,2,1,0,3,0,3,3,0,0,0,0,2,0,1,0,1,0,1
Colombia,Government,101,"Colombia V - Santos",Americas,1736,2,"Agreement on the Bilateral and Final Ceasefire, End of Hostilities, and Surrender of Weapons",2016-06-23,"Multiparty signed/agreed",12,30456,Intra,Cea,Ceas,"By the National Government:
Humberto de la Calle
Head of the National Government Peace Delegation

By the FARC -EP:
Iván Márquez
Head of the FARC-EP Peace Delegation
","By the Guarantor Countries:
By the Republic of Cuba
By the Kingdom of Norway

By the accompanying countries:
By the Bolivarian Republic of Venezuela
By the Republic of Chile","- Political participation: opening up democracy to build peace
- Integrated Security System for Political Activity
- General Agreement for Ending Conflict and Building Stable and Lasting Peace ",COL,,100,,289,1508,NA,856,0,0,0,0,0,0,0,0,0,0,0,0,0,0,0,0,0,0,0,0,0,0,0,0,0,0,0,0,0,0,3,0,0,1,0,0,0,0,0,0,0,0,0,0,0,0,0,0,0,1,1,1,0,0,0,0,0,0,0,0,0,0,0,0,0,0,0,1,1,0,1,0,0,0,0,0,0,0,1,0,0,0,0,0,0,0,0,0,0,0,0,0,0,0,0,0,0,0,0,0,0,0,0,0,0,1,1,1,0,0,0,0,0,0,0,0,0,0,1,0,0,0,0,0,0,0,0,0,0,0,0,0,1,0,0,0,0,0,0,0,0,0,0,0,0,0,0,0,0,0,0,1,0,1,0,0,0,1,0,0,0,0,0,0,0,0,0,0,0,0,0,1,1,0,0,0,0,0,0,0,0,0,0,0,0,0,0,0,0,0,0,0,0,0,0,0,0,0,0,0,1,3,1,0,1,0,3,0,1,0,1,0,0,0,0,0,1,2,1,0,0,0,0,0,0,0,2,0,0,0,0,0,0,0,0,1,0,1,1,1
Colombia,Government,101,"Colombia V - Santos",Americas,1655,2,"Joint Communique #70",2016-05-15,"Multiparty signed/agreed",4,8485,Intra,SubPar,Iss,"The National Government; the FARC-EP",,,COL,,100,,289,NA,NA,856,3,1,0,1,0,0,0,0,0,0,0,0,0,0,0,0,0,0,0,0,0,0,0,0,0,0,0,0,0,0,1,0,0,0,1,0,0,0,0,0,0,0,0,0,0,0,0,0,0,1,0,0,0,0,0,0,1,0,0,0,0,0,0,0,0,0,0,0,0,0,0,0,0,0,0,0,0,0,1,0,0,0,0,0,0,0,0,0,0,0,0,0,0,0,0,0,0,0,0,0,0,0,0,0,0,1,0,0,0,0,0,0,0,0,0,0,0,0,0,0,0,0,0,0,0,0,0,0,0,0,0,0,0,0,0,0,0,0,0,0,0,0,0,1,1,0,0,0,0,0,0,0,0,0,0,0,0,0,0,0,0,0,0,1,1,0,1,0,0,0,0,0,0,0,0,0,0,0,0,0,0,0,0,0,0,0,0,0,0,0,0,0,0,0,0,0,0,0,0,0,0,0,0,0,0,0,3,0,1,0,1,0,0,0,0,0,0,3,1,0,0,0,2,1,0,0,0,0,1,0,0,0,0,0,0,0,0,1,0,1
Colombia,Government,101,"Colombia V - Santos",Americas,1656,2,"Joint Communique #69",2016-05-12,"Multiparty signed/agreed",4,6954,Intra,SubPar,Iss,"The national government, the FARC-EP",,,COL,,100,,289,NA,NA,856,0,0,0,0,0,0,0,0,0,0,0,0,0,0,0,0,0,0,0,0,0,0,0,0,0,0,0,0,0,0,0,0,0,0,0,0,0,0,0,0,0,0,0,0,0,0,0,0,0,0,0,0,0,0,0,0,0,0,0,0,0,0,0,0,0,0,0,0,0,0,0,0,3,0,0,0,0,0,0,0,0,0,0,0,0,0,0,0,0,0,0,0,0,0,0,0,0,0,0,0,0,0,0,0,0,0,0,0,0,0,0,0,0,3,0,0,1,0,0,0,0,0,0,0,0,0,0,0,0,0,0,0,0,0,0,0,0,0,0,0,0,0,0,0,0,0,0,0,0,0,0,0,0,0,0,0,0,0,0,0,0,0,0,0,0,0,0,0,0,0,0,0,0,0,0,0,0,0,0,0,0,0,0,0,0,0,0,0,0,0,0,0,0,0,0,0,0,0,0,0,0,0,0,0,0,0,0,0,0,0,0,0,0,0,0,0,0,0,0,0,0,0,0,0,0,0,0,0,0,0,0,0,0,0,0,0,0,0,1,1
Colombia,Government,101,"Colombia V - Santos",Americas,1935,2,"Agreement between National Government and ELN to establish peace talks in Colombia",2016-03-30,"Multiparty signed/agreed",7,9335,Intra,Pre,PreMix,,,,COL,,100,,289,NA,NA,856,0,0,0,0,0,0,0,0,0,0,0,0,0,0,0,0,0,0,0,0,0,0,0,0,0,0,0,0,0,0,0,0,0,0,0,0,0,0,0,0,0,0,0,0,0,0,0,0,0,0,0,0,0,0,0,0,0,0,0,0,0,0,0,0,0,0,0,0,0,0,0,0,0,0,0,1,1,0,1,0,0,1,0,0,0,0,0,0,0,0,1,1,0,0,0,1,0,0,0,0,0,0,0,0,0,0,1,1,0,0,0,0,0,0,0,0,0,0,0,0,0,0,0,0,0,0,0,0,0,0,0,0,0,0,0,0,0,0,0,0,0,0,0,0,0,0,0,0,0,0,0,0,0,0,0,0,0,0,1,0,0,0,1,0,0,0,0,0,0,0,0,1,1,1,0,0,0,1,0,0,0,0,0,0,0,0,0,0,0,0,0,0,0,0,0,0,0,0,1,0,0,1,0,1,0,0,0,0,0,0,1,0,1,0,0,0,1,0,0,0,0,0,0,0,0,0,0,0,1,0,1,0,1,1,0,0,1,0,1,1
Colombia,Government,101,"Colombia V - Santos",Americas,1548,2,"Joint Communique #66",2016-01-22,"Multiparty signed/agreed",2,3543,Intra,SubPar,MultIss,"The national government, the FARC-EP",,,COL,,100,,289,NA,NA,856,0,0,0,0,0,0,0,0,0,0,0,0,0,0,0,0,0,0,0,0,0,0,0,0,0,0,0,0,0,0,0,0,0,0,0,0,0,0,0,0,0,0,0,0,0,0,0,0,0,1,0,0,0,0,0,0,0,0,0,0,0,0,0,0,0,0,0,0,0,0,0,0,0,0,0,0,0,0,1,0,0,0,0,0,0,0,0,0,0,0,0,0,0,0,0,0,0,0,0,0,0,0,0,0,0,0,0,0,0,0,0,0,0,0,0,0,0,0,0,0,0,0,0,0,0,0,0,0,0,0,0,0,0,0,0,0,0,0,0,0,0,0,0,0,0,0,0,0,0,0,0,0,0,0,0,0,0,0,0,0,0,0,0,0,0,0,0,0,0,0,0,0,0,0,0,0,0,0,0,0,0,0,0,0,0,0,0,0,0,0,0,0,0,0,0,0,0,0,0,0,0,0,0,0,0,0,0,0,0,0,0,0,0,0,0,0,0,0,0,0,0,0,0,0,0,0,0,0,0,0,0,0,0,0,0,0,0,0,1,1
Colombia,Government,101,"Colombia V - Santos",Americas,1549,2,"Joint Communique #65",2016-01-19,"Multiparty signed/agreed",1,2703,Intra,Imp,ImpMod,"The national government, the FARC-EP",,,COL,,100,,289,NA,NA,856,0,0,0,0,0,0,0,0,0,0,0,0,0,0,0,0,0,0,0,0,0,0,0,0,0,0,0,0,0,0,0,0,0,0,0,0,0,0,0,0,0,0,0,0,0,0,0,0,0,0,0,0,0,0,0,0,0,0,0,0,0,0,0,0,0,0,0,0,0,0,0,0,0,0,0,0,0,0,0,0,0,0,0,0,0,0,0,0,0,0,0,0,0,0,0,0,0,0,0,0,0,0,0,0,0,0,0,0,0,0,0,0,0,0,0,0,0,0,0,0,0,0,0,0,0,0,0,0,0,0,0,0,0,0,0,0,0,0,0,0,0,0,0,0,0,0,0,0,0,0,0,0,0,0,0,0,0,0,0,0,0,0,0,0,0,0,0,0,0,0,0,0,0,0,0,0,0,0,0,0,0,0,0,0,0,0,0,0,0,0,0,0,0,0,0,0,0,0,0,0,1,0,0,0,0,0,0,0,0,0,0,0,0,0,0,0,0,0,0,0,0,0,0,0,0,0,0,0,0,0,0,0,0,0,0,0,0,1,1,1
Colombia,Government,101,"Colombia V - Santos",Americas,1547,1,"Agreement on the Victims of Conflict, 'Comprehensive System for Truth, Justice, Reparation and Non-repitition, including the Special Jurisdiction for Peace; and Commitment on Human Rights",2015-12-15,"Multiparty signed/agreed",63,174228,Intra,SubPar,Iss,"The national government, the FARC-EP",,,COL,,100,,289,1581,,856,3,1,0,1,0,3,1,0,1,0,3,1,0,1,0,0,0,0,0,0,3,1,0,1,0,0,0,0,0,0,3,1,0,1,0,3,0,0,1,0,3,0,1,0,0,0,0,0,0,1,1,1,0,1,1,0,1,0,0,0,0,0,0,0,0,0,0,0,0,0,0,0,0,0,0,0,0,0,1,1,0,0,0,0,0,0,0,0,0,0,0,0,0,0,0,0,0,0,0,0,0,0,0,0,0,1,2,3,3,0,1,1,1,3,0,0,1,0,1,0,0,0,0,0,0,1,0,1,0,0,0,1,0,0,0,0,0,0,0,0,0,0,0,1,1,0,0,0,0,0,0,1,0,3,0,1,0,0,0,0,0,0,0,0,0,0,0,0,0,0,0,1,1,0,0,0,0,0,0,0,0,0,0,0,0,0,0,0,1,0,1,0,0,1,1,0,1,1,1,0,1,0,0,0,0,0,2,0,1,0,1,0,0,0,2,0,0,3,1,0,0,0,3,1,1,3,0,0,3,3,3,0,1,3,0,0,0,0,0,1
Colombia,Government,101,"Colombia V - Santos",Americas,1368,1,"Joint Communiqué #62, Havana ",2015-10-17,"Multiparty signed/agreed",4,16927,Intra,SubPar,Iss,"Colombian National Government; FARC – EP; ",,,COL,,100,,289,,,856,0,0,0,0,0,0,0,0,0,0,0,0,0,0,0,0,0,0,0,0,0,0,0,0,0,0,0,0,0,0,0,0,0,0,0,0,0,0,0,0,0,0,0,0,0,0,0,0,0,0,0,0,0,0,0,0,1,0,0,0,0,0,0,0,0,0,0,0,0,0,0,0,0,0,0,0,0,0,1,0,0,0,0,0,0,0,0,0,0,0,0,0,0,0,0,0,0,0,0,0,0,0,0,0,0,0,0,0,0,0,0,0,0,0,0,0,0,0,0,0,0,0,0,0,0,0,0,0,0,0,0,0,0,0,0,0,0,0,0,0,0,0,0,0,0,0,0,0,0,0,0,1,0,0,0,0,0,0,0,0,0,0,0,0,0,0,0,0,1,0,0,0,0,0,0,0,0,0,0,0,0,0,0,0,0,0,0,0,0,0,0,0,0,0,0,0,0,0,0,0,0,0,0,0,0,0,0,0,0,0,0,0,0,0,0,0,0,0,0,0,0,0,0,0,0,3,0,0,2,3,2,0,1,0,0,0,0,0,0,1
Colombia,Government,101,"Colombia V - Santos",Americas,1369,1,"Joint Communiqué # 60 regarding the Agreement of the Creation of a Special Jurisdiction for Peace",2015-09-23,"Multiparty signed/agreed",2,5409,Intra,SubPar,Iss,"Government of the Republic of Colombia; the FARC-EP",,,COL,,100,,289,1580,,856,0,0,0,0,0,0,0,0,0,0,0,0,0,0,0,0,0,0,0,0,0,0,0,0,0,0,0,0,0,0,0,0,0,0,0,0,0,0,0,0,0,0,0,0,0,0,0,0,0,1,0,0,0,0,0,0,0,0,0,0,0,0,0,0,0,0,0,0,0,0,0,0,0,0,0,1,1,0,1,0,0,0,0,0,0,0,0,0,0,0,0,0,0,0,0,0,0,0,0,0,0,0,0,0,0,1,0,0,0,0,0,0,0,2,0,0,1,0,0,0,0,0,0,0,0,0,0,0,0,0,0,0,0,0,0,0,0,0,0,0,0,0,0,0,0,0,0,0,0,0,0,0,0,0,0,0,0,0,0,0,0,0,0,0,0,0,0,0,1,0,0,0,0,0,0,0,0,0,0,0,0,0,0,0,0,0,0,0,0,0,0,0,0,0,0,0,0,0,0,0,0,0,0,0,0,0,0,0,0,0,1,0,0,0,0,0,0,2,1,0,0,0,1,1,0,2,0,0,3,0,2,0,1,0,0,0,0,0,0,1
Colombia,Government,101,"Colombia V - Santos",Americas,1397,1,"Joint Communiqué #55, Havana ",2015-07-12,"Multiparty signed/agreed",2,3287,Intra,Pre,PreMix,"The National Government; the FARC - EP",,,COL,,100,,289,,,856,0,0,0,0,0,0,0,0,0,0,0,0,0,0,0,0,0,0,0,0,0,0,0,0,0,0,0,0,0,0,0,0,0,0,0,0,0,0,0,0,0,0,0,0,0,0,0,0,0,1,1,1,0,0,0,0,0,0,0,0,0,0,0,0,0,0,0,0,0,0,0,0,0,0,0,0,0,0,0,0,0,0,0,0,0,0,0,0,0,0,0,0,0,0,0,0,0,0,0,0,0,0,0,0,0,0,0,0,1,1,0,0,0,0,0,0,0,0,0,0,0,0,0,0,0,0,0,0,0,0,0,0,0,0,0,0,0,0,0,0,0,0,0,0,0,0,0,0,0,0,0,0,0,0,0,0,0,0,0,0,0,0,0,0,0,0,0,0,0,0,0,0,0,0,0,0,0,0,0,0,0,0,0,0,0,0,0,0,0,0,0,0,0,0,0,0,0,0,0,0,0,2,1,0,0,0,0,0,0,0,1,0,0,0,0,0,0,0,0,0,0,0,0,0,0,0,0,0,0,0,0,0,0,0,0,0,0,1,0,1
Colombia,Government,101,"Colombia V - Santos",Americas,1398,1,"Joint Report of the Dialogue Table between the Government and the Revolutionary Armed Forces of Colombia - People's Army ",2015-06-04,"Multiparty signed/agreed",8,26386,Intra,SubPar,Iss,"The Government of Colombia; the Revolutionary Armed Forces of Colombia – People’s
Army (FARC – EP)",,,COL,,100,,289,,,856,1,1,0,0,0,1,1,0,0,0,1,1,0,0,0,0,0,0,0,0,1,1,0,0,0,0,0,0,0,0,3,1,0,1,0,3,0,0,1,0,2,0,1,0,0,0,0,0,0,1,0,0,0,0,0,0,0,0,0,0,0,0,0,0,0,0,0,0,0,0,0,0,0,0,0,0,0,0,1,0,0,0,0,0,0,0,0,0,0,0,0,0,0,0,0,0,0,0,0,0,0,0,0,0,0,1,2,1,0,0,0,0,0,0,0,0,0,0,0,0,0,0,0,0,0,0,0,0,0,0,0,0,0,0,0,0,0,0,0,0,0,0,0,0,0,0,0,0,0,0,0,0,0,3,0,1,0,0,0,0,0,0,0,0,0,0,0,0,0,0,0,0,0,0,0,0,0,0,0,0,0,0,0,0,0,0,0,0,0,0,0,0,0,0,0,0,0,0,0,0,1,0,0,0,0,0,0,0,0,0,1,0,0,0,0,0,0,0,0,0,0,0,1,1,0,3,0,0,3,0,0,0,0,1,0,0,0,0,1,1
Colombia,Government,101,"Colombia V - Santos",Americas,1396,1,"Joint Communiqué #53, Havana ",2015-03-27,"Multiparty signed/agreed",1,2578,Intra,Imp,ImpMod,"The National Government; the FACR – EP",,,COL,,100,,289,,,856,0,0,0,0,0,0,0,0,0,0,0,0,0,0,0,0,0,0,0,0,0,0,0,0,0,0,0,0,0,0,0,0,0,0,0,0,0,0,0,0,0,0,0,0,0,0,0,0,0,1,0,0,0,0,0,0,0,0,0,0,0,0,0,0,0,0,0,0,0,0,0,0,0,0,0,0,0,0,1,0,0,0,0,0,0,0,0,0,0,0,0,0,0,0,0,0,0,0,0,0,0,0,0,0,0,0,0,0,0,0,0,0,0,0,0,0,0,0,0,0,0,0,0,0,0,0,0,0,0,0,0,0,0,0,0,0,0,0,0,0,0,0,0,0,0,0,0,0,0,0,0,0,0,0,0,0,0,0,0,0,0,0,0,0,0,0,0,0,0,0,0,0,0,0,0,0,0,0,0,0,0,0,0,0,0,0,0,0,0,0,0,0,0,0,0,0,0,0,0,0,0,0,0,0,0,0,1,1,0,0,0,0,0,0,0,0,0,0,0,0,0,0,0,0,0,0,0,0,1,0,0,0,0,0,0,0,0,0,0,1
Colombia,Government,101,"Colombia V - Santos",Americas,1395,1,"Joint Communiqué #52, Havana ",2015-03-07,"Multiparty signed/agreed",3,6276,Intra,SubPar,Iss,"The Government; the FARC – EP",,,COL,,100,,289,,,856,0,0,0,0,0,0,0,0,0,0,0,0,0,0,0,0,0,0,0,0,0,0,0,0,0,0,0,0,0,0,0,0,0,0,0,0,0,0,0,0,0,0,0,0,0,0,0,0,0,1,1,1,0,0,0,0,0,0,0,0,0,0,0,0,0,0,0,0,0,0,0,0,0,0,0,0,0,0,1,0,0,0,0,0,0,0,0,0,0,0,0,0,0,0,0,0,0,0,0,0,0,0,0,0,0,0,0,0,0,0,0,0,0,0,0,0,0,0,0,0,0,0,0,0,0,0,0,0,0,0,0,0,0,0,0,0,0,0,0,0,0,0,0,0,0,0,0,0,0,0,0,1,0,0,0,0,0,0,0,0,0,0,0,0,0,0,0,0,0,0,0,0,0,0,0,0,0,0,0,0,0,0,0,0,0,0,0,0,0,0,0,0,0,0,0,0,0,0,0,0,1,0,0,0,0,0,0,0,0,0,0,0,0,0,0,0,2,0,0,0,0,0,0,0,0,0,0,0,0,0,0,0,0,0,0,0,0,0,1,1
Colombia,Government,101,"Colombia V - Santos",Americas,1394,1,"Joint Communiqué, Havana, December 3, 2014",2014-12-03,"Multiparty signed/agreed",1,1303,Intra,Pre,Proc,"The National Government; the FARC-EP",,,COL,,100,,289,,,856,0,0,0,0,0,0,0,0,0,0,0,0,0,0,0,0,0,0,0,0,0,0,0,0,0,0,0,0,0,0,0,0,0,0,0,0,0,0,0,0,0,0,0,0,0,0,0,0,0,1,0,0,0,0,0,0,0,0,0,0,0,0,0,0,0,0,0,0,0,0,0,0,0,0,0,0,0,0,1,0,0,0,0,0,0,0,0,0,0,0,0,0,0,0,0,0,0,0,0,0,0,0,0,0,0,0,0,0,0,0,0,0,0,0,0,0,0,0,0,0,0,0,0,0,0,0,0,0,0,0,0,0,0,0,0,0,0,0,0,0,0,0,0,0,0,0,0,0,0,0,0,0,0,0,0,0,0,0,0,0,0,0,0,0,0,0,0,0,0,0,0,0,0,0,0,0,0,0,0,0,0,0,0,0,0,0,0,0,0,0,0,0,0,0,0,0,0,0,0,0,0,0,0,0,0,0,0,0,0,0,0,0,0,0,0,0,0,0,0,0,0,0,0,0,0,0,0,0,1,0,0,0,0,0,0,0,0,0,1,1
Colombia,Government,101,"Colombia V - Santos",Americas,1392,1,"Joint Communiqué, Havana, August 5, 2014",2014-08-05,"Multiparty signed/agreed",5,12664,Intra,SubPar,MultIss,"The National Government; the FARC – EP",,,COL,,100,,289,,,856,0,0,0,0,0,0,0,0,0,0,0,0,0,0,0,0,0,0,0,0,0,0,0,0,0,0,0,0,0,0,3,0,0,1,0,3,0,0,1,0,0,0,0,0,0,0,0,0,0,1,0,0,0,0,0,0,0,0,0,0,0,0,0,0,0,0,0,0,0,0,0,0,0,0,0,0,0,0,1,0,0,0,0,0,0,0,0,0,0,0,0,0,0,0,0,0,0,0,0,0,0,0,0,0,0,1,1,0,1,0,1,0,0,0,0,0,0,0,0,0,0,0,0,0,0,0,0,0,0,0,0,0,0,0,0,0,0,0,0,0,0,0,0,0,0,0,0,0,0,0,0,0,0,1,0,1,0,0,0,0,0,0,0,0,0,0,0,0,0,0,0,0,0,0,0,0,0,0,0,0,0,0,0,0,0,0,0,0,0,0,0,0,0,0,0,0,0,0,0,0,0,2,1,0,0,0,0,0,0,0,0,0,0,0,0,0,0,0,0,0,0,0,0,0,0,3,0,0,2,0,1,0,1,0,0,0,0,0,0,1
Colombia,Government,101,"Colombia V - Santos",Americas,1391,1,"Joint Communiqué, Havana, July 17, 2014",2014-07-17,"Multiparty signed/agreed",2,3289,Intra,Pre,Proc,"The agreement is a joint communication of the National Government and the FARC-EP",,,COL,,100,,289,,,856,0,0,0,0,0,0,0,0,0,0,0,0,0,0,0,0,0,0,0,0,0,0,0,0,0,0,0,0,0,0,0,0,0,0,0,0,0,0,0,0,0,0,0,0,0,0,0,0,0,0,0,0,0,0,0,0,0,0,0,0,0,0,0,0,0,0,0,0,0,0,0,0,0,0,0,0,0,0,1,1,0,0,0,0,0,0,0,0,0,0,0,0,0,0,0,0,0,0,0,0,0,0,0,0,0,1,1,0,0,0,0,0,0,0,0,0,0,0,0,0,0,0,0,0,0,0,0,0,0,0,0,0,0,0,0,0,0,0,0,0,0,0,0,0,0,0,0,0,0,0,0,0,0,0,0,0,0,0,0,0,0,0,0,0,0,0,0,0,0,0,0,0,0,0,0,0,0,0,0,0,0,0,0,0,0,0,0,0,0,0,0,0,0,0,0,0,0,0,0,0,0,0,0,0,0,0,0,0,0,0,0,0,0,0,0,0,0,0,0,0,0,0,0,0,0,2,0,0,2,0,0,0,0,1,0,0,0,1,0,1
Colombia,Government,101,"Colombia V - Santos",Americas,817,1,"Hacia un Nuevo Campo Colombiano: Reforma Rural Integral",2014-06-06,"Multiparty signed/agreed",22,56942,Intra,SubPar,Iss,"Delegates of Government of the Republic of Colombia (The National Government) and the Revolutionary Armed Forces of Colombia (FARC-EP)
 
Los delegados del Gobierno de la República de Colombia (el Gobierno Nacional) y las Fuerzas Armadas Revolucionarias de Colombia (FARC-EP)",,,COL,,100,,289,1507,,856,3,1,0,1,0,2,0,0,1,0,3,1,0,1,0,0,0,0,0,0,3,1,0,1,0,0,0,0,0,0,3,1,0,1,0,3,0,0,1,0,1,0,1,0,0,0,0,0,0,1,1,1,0,0,0,0,1,0,0,0,0,0,0,0,0,0,0,0,0,0,0,0,0,0,0,0,0,0,1,0,0,0,0,0,0,0,0,0,0,0,0,0,0,0,0,0,0,0,0,0,0,0,0,0,0,1,3,0,3,0,1,0,1,0,0,0,0,0,0,0,0,0,0,0,0,0,0,0,0,0,0,0,0,1,0,0,0,0,0,0,0,0,1,0,0,0,0,0,0,0,0,1,0,0,0,0,0,0,0,0,0,0,0,0,0,0,0,0,0,0,0,3,1,0,0,1,0,0,0,3,0,1,0,0,0,0,0,0,1,1,1,0,0,1,1,0,0,1,1,1,0,0,0,0,0,0,0,0,0,0,0,0,0,2,2,0,0,0,0,0,0,0,0,0,0,0,0,0,2,0,1,0,1,1,0,0,0,0,0,1
