Georgia/Russia/(Ossetia),Government/territory,44,"South Ossetia peace process","Europe and Eurasia",1701,1,"Agreement between the Government of the Russian Federation and the Government of the Republic of Georgia on Restoration of Economy in the Zone of the Georgian-Ossetian Conflict",1993-09-14,"Multiparty signed/agreed",2,2600,InterIntra,SubPar,Iss,"On Behalf of the Government of the Russian Federation A. Shokhin
On Behalf of the Government of the Republic of Georgia O. Patsatsia",,"Agreement on “Principles of Settlement of Georgian-Ossetian Conflict, signed on 24 June 1992.",GEO,RUS,372,365,393,,,,0,0,0,0,0,0,0,0,0,0,0,0,0,0,0,0,0,0,0,0,0,0,0,0,0,0,0,0,0,0,0,0,0,0,0,0,0,0,0,0,1,0,1,0,0,0,0,0,0,0,0,0,0,0,0,0,0,0,0,0,0,0,0,0,0,0,0,0,0,0,0,0,0,0,0,0,0,0,0,0,0,0,0,0,0,0,0,0,0,0,0,0,0,0,0,0,0,0,0,0,0,0,0,0,0,0,0,0,0,0,0,0,0,0,0,0,0,0,0,0,0,0,0,0,0,0,0,0,0,0,0,0,0,0,0,0,0,0,0,0,0,0,0,0,0,0,0,0,0,0,0,0,0,1,0,0,0,1,0,0,0,0,0,0,0,0,0,0,0,0,0,2,1,0,1,0,0,1,0,0,0,0,0,0,0,0,0,0,0,0,0,0,0,0,0,0,0,0,0,0,0,0,0,0,0,0,0,0,0,0,0,0,0,0,0,0,0,0,0,0,0,0,0,0,0,0,0,0,0,0,0,0,0,0,0,0,0,0,0,1
Georgia/Russia/Ossetia,Government/territory,44,"South Ossetia peace process","Europe and Eurasia",1700,1,"Protocol of the Meeting of Representatives of the Parties on the Implementation of the Agreement on Principles of Settlement of the Georgian-Ossetian Conflict",1992-07-04,"Multiparty signed/agreed",2,3078,Intra,Cea,Rel,"Russian Federation: S. K. Shoigu, F. N. Kovalev, A. N. Kulikov, S. A. Mikhailov, A. E. Safonov, I. L.Vorobyev, G. B. Filatov, A. Kh.Galazov, S. V. Khetagurov, I. G. Biragova, S. N. Suanova, I. L. Bzaev, G. M. Kantemirov. 

Republic of Georgia: T. K. Kitovani, A. I. Kavsadze, R. L. Gventsadze, G. V. Pipia, T. G. Kulumbegov, V. N. Khubulov, S. I. Kochiev, P. G. Gazaev, L. K.Tibilov, A. N. Kabisov, O. D. Teziev 


SIGNED: S. K. Shoigu, T. Kitovani, A. Kh. Galazov, T. G. Kulumbegov ",,"Sochi Agreement",GEO,RUS,372,365,393,,,,0,0,0,0,0,0,0,0,0,0,0,0,0,0,0,0,0,0,0,0,0,0,0,0,0,0,0,0,0,0,0,0,0,0,0,0,0,0,0,0,2,0,1,0,0,0,0,0,0,0,0,0,0,0,0,0,0,0,0,0,0,0,0,0,0,0,0,0,0,0,0,0,0,0,0,0,0,0,0,0,0,0,0,0,0,0,0,0,0,0,0,0,0,0,0,0,0,0,0,0,3,1,0,0,0,0,0,0,0,0,0,0,0,0,0,0,0,0,0,0,0,0,0,0,0,0,0,0,0,0,0,0,0,0,0,0,0,0,0,0,0,0,0,0,0,0,0,0,0,0,0,0,0,2,0,1,0,0,0,0,0,0,0,0,0,0,0,0,0,0,0,0,0,0,0,0,0,0,0,0,0,0,0,0,0,0,0,0,0,0,0,0,0,0,0,0,0,0,0,0,0,2,1,0,1,0,0,0,0,0,1,1,0,0,0,0,0,0,0,0,0,0,0,0,0,0,0,0,0,0,0,0,0,0,0,0,0,0,0,1
Georgia/Russia/(Ossetia),Government/territory,44,"South Ossetia peace process","Europe and Eurasia",1699,1,"Agreement on Principles of Settlement of the Georgian-Ossetian Conflict (Sochi Agreement)",1992-06-24,"Multiparty signed/agreed",2,4355,InterIntra,Cea,Ceas,"On behalf of the Republic of Georgia E. A. Shevardnadze 
On behalf of the Russian Federation B. N. Yeltsin ",,"""the agreements reached in Kazbegi""",GEO,RUS,372,365,393,,,,0,0,0,0,0,0,0,0,0,0,0,0,0,0,0,0,0,0,0,0,1,1,0,0,0,0,0,0,0,0,0,0,0,0,0,0,0,0,0,0,1,0,1,0,0,0,0,0,0,0,0,0,0,0,0,0,0,0,0,0,0,0,0,0,0,0,0,0,0,0,0,0,0,0,0,0,0,0,0,0,0,0,0,0,0,0,0,0,0,0,0,0,0,0,0,0,0,0,0,0,0,0,0,0,0,1,0,0,0,0,0,0,0,1,0,0,1,0,0,0,0,0,0,0,0,0,0,0,0,0,0,0,0,0,0,0,0,0,0,0,0,0,0,0,0,0,0,0,0,0,0,1,0,2,0,1,0,0,0,0,0,0,0,0,0,0,0,0,0,0,0,1,1,1,0,0,0,0,0,0,0,0,0,0,0,0,0,0,0,0,0,0,0,0,0,0,0,0,0,0,0,3,1,0,0,0,2,1,0,0,0,1,0,0,0,0,0,0,0,0,0,0,0,0,0,0,0,0,0,0,0,0,0,0,0,0,0,0,1,1
"Ireland/United Kingdom/Northern Ireland",Government/territory,62,"Northern Ireland peace process","Europe and Eurasia",2270,4,"New Decade, New Approach ",2020-01-10,"Multiparty signed/agreed",62,109643,Intra,Imp,ExtSub,"Government of the United Kingdom
Government of the Republic of Ireland
Democratic Unionist Party
Sinn Féin
Ulster Unionist Party
Social Democratic and Labour Party
The Alliance Party of Northern Ireland",,"The Agreement Reached in the Multi-Party Negotiations (Good Friday Agreement or Belfast Agreement) Stormont House Agreement",GBR,IRL,200,205,315,,,,3,0,0,1,0,2,0,0,1,0,1,0,0,1,0,0,0,0,0,0,1,0,1,0,0,0,0,0,0,0,0,0,0,0,0,0,0,0,0,0,0,0,0,0,0,0,0,0,0,1,0,0,0,0,0,0,0,0,0,0,0,0,0,0,0,0,0,3,0,1,0,0,0,3,0,0,0,0,1,0,3,3,0,0,1,0,0,1,0,0,0,0,0,0,0,0,0,0,0,0,0,0,0,0,0,1,0,0,0,0,0,0,0,3,0,1,0,1,0,0,0,0,0,0,0,0,0,0,0,0,0,0,0,1,0,0,0,0,0,0,0,1,0,0,0,0,0,0,0,0,0,0,0,3,0,0,0,1,0,0,0,0,0,1,0,1,0,0,0,0,0,3,1,0,1,1,0,0,1,2,0,1,0,0,0,0,0,0,0,0,0,0,0,1,1,1,1,1,1,0,0,0,0,0,2,2,0,0,0,0,1,0,3,2,2,1,0,0,0,0,0,0,0,0,0,2,0,0,0,0,2,0,1,2,0,0,0,0,1,1
"Ireland/United Kingdom/(Northern Ireland)",Government/territory,62,"Northern Ireland peace process","Europe and Eurasia",1801,2,"Agreement between the Government of the United Kingdom of Great Britain and Northern Ireland and the Government of Ireland Establishing the Independent Reporting Commission",2016-09-13,"Multiparty signed/agreed",5,8232,InterIntra,Imp,ExtSub,"For the Government of the United Kingdom of Great Britain and Northern Ireland: James Brokenshire
For the Government of Ireland: Charles Flanagan",,"Page 1, Untitled preamble
...Recalling the agreement reached in multi-party negotiations and annexed to the Agreement signed by both Governments on 10 April 1998 (the Agreement between the Government of Ireland and the Government of the United Kingdom of Great Britain and Northern Ireland done at Belfast on 10 April 1998); Recalling subsequent agreements, including the St. Andrew’s Agreement, the Hillsborough Agreement devolving policing and justice powers, the Stormont House Agreement and the agreement reached on 17 November 2015, “A Fresh Start, The Stormont Agreement and Implementation Plan”;...",GBR,IRL,200,205,,,,,0,0,0,0,0,0,0,0,0,0,0,0,0,0,0,0,0,0,0,0,0,0,0,0,0,0,0,0,0,0,0,0,0,0,0,0,0,0,0,0,0,0,0,0,0,0,0,0,0,0,0,0,0,0,0,0,0,0,0,0,0,0,0,0,0,0,0,0,0,0,0,0,0,0,0,0,0,0,1,0,0,0,0,0,0,0,0,0,0,0,0,0,0,0,0,0,0,0,0,0,0,0,0,0,0,1,0,0,0,0,0,0,0,0,0,0,0,0,0,0,0,0,0,0,0,0,0,0,0,0,0,0,0,0,0,0,0,0,0,0,0,0,0,0,0,0,0,0,0,0,0,0,0,0,0,0,0,0,0,0,0,0,0,0,0,0,0,0,0,0,0,0,0,0,0,0,0,0,0,0,0,0,0,0,0,0,0,0,0,0,0,0,0,0,0,0,0,0,0,0,0,0,0,0,1,0,0,0,0,0,1,0,0,0,0,0,0,0,0,0,0,0,0,0,0,0,0,0,0,0,0,0,0,0,0,0,0,0,0,1
"Ireland/United Kingdom/Northern Ireland",Government/territory,62,"Northern Ireland peace process","Europe and Eurasia",1435,1,"A Fresh Start: The Stormont Agreement and Implementation Plan",2015-11-17,"Multiparty signed/agreed",67,91912,Intra,Imp,ExtSub,"Participants listed as: the UK and Irish Governments, and the five main Northern Ireland parties
Ministerial introduction signed by: First Minister Peter Robinson; deputy First Minister Martin Guinness
Foreword signed by the Rt Hon Theresa Villiers MP Secretary of State for Northern Ireland; 
Foreword signed by Mr Charles Flanagan TD Minister of Foreign Affairs and Trade  "," ","Page 14, SECTION “A” Ending Paramilitarism and Tackling Organised Crime, Introduction, 1.2 The Executive and the UK and Irish Governments recommit to:...giving full effect to the principles of peace and democracy set out in previous Agreements including the growth of mutual respect and equality of treatment that forms the basis of a united and stable society;

Page 14-15, SECTION “A” Ending Paramilitarism and Tackling Organised Crime, Statement of Principles 2.4
Building on the Mitchell Principles that affirmed all the main parties were committed to democratic and exclusively peaceful means of resolving political issues the Executive agreed to a Ministerial Code and Pledge of Office that incorporated: a commitment to non-violence; support for law and order; and support for the PSNI and the criminal justice system.

Page 21, SECTION “B” NI Executive Financial Reforms and Context, NI Executive’s position on Corporation Tax, 1.18
In accordance with the requirements of the Stormont House Agreement, the Executive reaffirms its commitment to take all the actions necessary to demonstrate that its finances are on a sustainable footing for the long term including successfully implementing measures in the Stormont House Agreement, this Agreement and subsequent reform measures.

Page 24, SECTION “D” UK Government Financial Support
This section sets out the financial support the UK Government will provide to support implementation of the SHA and this Agreement and a number of accompanying NI Executive commitments.

Page 30, SECTION “E” Irish Government Financial Support, 1.1 
...This is crucial for job creation and all-island prosperity and to ensure that the socio- economic dividend made possible by the Belfast/Good Friday and subsequent Agreements is fully realised.

Page 30-31, SECTION “E” Irish Government Financial Support, A5 Western Transport Corridor Serving the North West, 2.1 
The Irish Government remains supportive of the commitment under the St Andrews Agreement to co-fund the construction of the A5 through Northern Ireland to Derry- Londonderry, which will improve access to Derry-Londonderry and North Donegal. The timeframe for this period is dependent on planning issues which are currently being addressed by the Northern Ireland authorities. 

Page 39, SECTION “F” Implementation of other aspects of the Stormont House Agreement, Outstanding Commitments, 70
On the St Andrews Agreement Review, the NSMC (meeting in Institutional format) will agree before the end of February 2015 a report on new sectoral priorities for North-South cooperation, identified during Ministerial discussions since November 2013. A report on new sectoral priorities will be a standing item for future meetings of the NSMC meeting in Institutional format.",GBR,IRL,200,205,315,,,,3,0,0,1,0,0,0,0,0,0,0,0,0,0,0,0,0,0,0,0,2,0,0,1,0,2,0,0,1,0,0,0,0,0,0,0,0,0,0,0,0,0,0,0,0,0,0,0,0,1,0,0,0,0,0,0,0,1,0,0,0,0,0,0,0,0,1,3,0,1,0,0,0,2,0,0,0,0,1,0,0,3,0,1,1,0,0,1,0,0,0,0,0,0,0,0,0,0,0,0,0,0,0,0,0,1,2,2,1,0,1,1,0,1,0,0,1,0,0,0,0,0,0,0,0,0,0,0,0,0,0,0,0,0,0,0,0,0,0,0,0,0,0,0,0,0,0,0,0,0,0,0,0,3,0,1,0,0,0,0,0,0,0,1,0,1,0,0,0,0,0,3,1,0,1,1,0,1,2,3,1,1,0,0,0,0,0,0,0,0,0,0,0,1,1,1,1,0,1,0,0,0,0,0,2,0,1,1,0,0,1,0,0,3,0,0,3,0,0,0,0,0,0,0,0,0,0,0,1,0,0,0,0,3,0,0,0,0,0,1
"Ireland/United Kingdom/Northern Ireland",Government/territory,62,"Northern Ireland peace process","Europe and Eurasia",903,1,"Stormont House Agreement",2014-12-23,"Multiparty signed/agreed",14,5218,Intra,Imp,ImpMod,"Not signed, agreement known to be between the Northern Ireland political parties, but parties unlisted. ",,"Page 13-14, Outstanding Issues, 70.
On the St Andrews Agreement Review, the NSMC (meeting in Institutional format) will agree before the end of February 2015 a report on new sectoral priorities for North/South cooperation, identified during Ministerial discussions since November 2013. A report on new sectoral priorities will be a standing item for future meetings of the NSMC meeting in
Institutional format.
",GBR,IRL,200,205,315,,,,0,0,0,0,0,2,0,0,1,0,0,0,0,0,0,0,0,0,0,0,2,0,0,1,0,2,0,0,1,0,0,0,0,0,0,0,0,0,0,0,0,0,0,0,0,0,0,0,0,1,0,0,0,0,0,0,1,1,0,0,0,0,1,0,0,0,1,3,1,0,0,0,0,2,0,0,0,0,1,0,1,2,0,1,1,0,1,1,0,0,0,0,0,0,0,0,0,0,0,0,0,0,0,0,0,1,2,0,0,0,0,0,0,1,0,0,1,0,0,0,0,0,0,0,0,0,0,0,0,0,0,0,0,0,0,0,0,0,0,0,0,0,0,0,0,0,0,0,0,0,0,0,0,0,0,0,0,0,0,0,0,0,0,1,0,1,0,0,0,0,0,1,1,0,0,1,0,0,0,2,0,1,0,0,0,0,0,0,0,0,0,0,0,1,1,1,1,0,0,0,0,0,0,0,1,0,0,0,0,0,0,0,0,0,0,0,0,2,1,0,0,0,1,1,0,3,0,0,3,0,0,0,0,3,0,0,0,0,1,1
"Ireland/United Kingdom/(Northern Ireland)",Government/territory,62,"Northern Ireland peace process","Europe and Eurasia",904,1,"Stormont House Agreement Financial Annex",2014-12-23,"Multiparty signed/agreed",5,9552,InterIntra,Imp,ImpMod,"UK Government ",,,GBR,IRL,200,205,315,,,,1,1,0,0,0,0,0,0,0,0,0,0,0,0,0,0,0,0,0,0,0,0,0,0,0,0,0,0,0,0,0,0,0,0,0,0,0,0,0,0,0,0,0,0,0,0,0,0,0,0,0,0,0,0,0,0,0,0,0,0,0,0,0,0,0,0,0,0,0,0,0,0,0,0,0,0,0,0,0,0,0,0,0,0,0,0,0,0,0,0,0,0,0,0,0,0,0,0,0,0,0,0,0,0,0,0,0,0,0,0,0,0,0,0,0,0,0,0,0,0,0,0,0,0,0,0,0,0,0,0,0,0,0,0,0,0,0,0,0,0,0,0,0,0,0,0,0,0,0,0,0,0,0,0,0,0,0,0,0,0,0,0,0,0,0,0,0,0,0,0,0,2,1,0,0,1,0,0,0,3,1,0,0,0,0,0,0,0,0,0,0,0,0,0,0,0,0,0,0,0,0,0,0,0,1,0,0,0,0,0,0,0,0,0,0,0,3,0,0,0,0,0,0,0,0,0,0,0,0,0,0,0,0,0,0,0,0,0,0,1
"Ireland/United Kingdom/Northern Ireland",Government/territory,62,"Northern Ireland peace process","Europe and Eurasia",764,1,"Hillsborough Castle Agreement",2010-02-05,"Multiparty signed/agreed",21,21542,Intra,Imp,ExtSub,"1. First Minister Peter Robinson (Democratic Unionist Party)
2. Deputy First Minister Martin McGuinness (Sinn Féin) 

However, the agreement also includes a letter from The Prime Minister of the UK, and therefore includes commitments from the UK Government.
",,,GBR,IRL,200,205,315,,,,1,1,0,0,0,0,0,0,0,0,0,0,0,0,0,0,0,0,0,0,0,0,0,0,0,0,0,0,0,0,0,0,0,0,0,0,0,0,0,0,0,0,0,0,0,0,0,0,0,1,0,0,0,0,0,0,0,0,0,0,0,0,0,0,0,0,0,2,1,0,0,0,0,0,0,0,0,0,1,0,0,3,0,1,1,0,0,1,0,0,0,0,0,0,0,0,0,0,0,0,0,0,0,0,0,1,3,0,0,0,0,0,0,0,0,0,0,0,0,0,0,0,0,0,0,0,0,0,0,0,0,0,0,0,0,0,0,0,0,0,0,0,0,1,1,0,0,0,0,0,0,0,0,0,0,0,0,0,0,0,0,0,0,1,0,1,0,0,1,1,0,0,0,0,0,1,0,0,0,0,0,0,0,0,0,0,0,0,1,1,0,0,0,1,1,0,1,0,0,0,0,0,0,0,3,0,0,0,0,0,0,0,0,0,0,0,0,0,0,0,0,0,0,0,0,0,0,0,2,0,3,0,1,0,0,0,0,0,1,1
"Ireland/United Kingdom/Northern Ireland",Government/territory,62,"Northern Ireland peace process","Europe and Eurasia",126,1,"St Andrews Agreement",2006-10-13,"Multiparty signed/agreed",16,24436,Intra,Imp,ExtSub,"United Kingdom Government, Republic of Ireland Government are formally parties, however the agreement covers commitments of the political parties ",,,GBR,IRL,200,205,315,,,,0,0,0,0,0,0,0,0,0,0,0,0,0,0,0,0,0,0,0,0,0,0,0,0,0,3,0,0,1,0,0,0,0,0,0,0,0,0,0,0,0,0,0,0,0,0,0,0,0,0,0,0,0,0,0,0,0,0,0,0,0,0,0,0,0,0,0,3,1,0,0,0,0,0,0,0,0,0,1,0,1,3,0,1,1,1,1,1,1,1,0,0,0,0,0,0,0,0,0,0,0,0,0,0,0,1,1,1,0,0,0,0,0,3,0,1,0,0,0,0,0,0,0,0,0,0,0,0,0,0,0,0,0,0,0,0,0,0,0,0,0,0,0,1,1,0,0,0,0,0,0,1,0,0,0,0,0,0,0,0,0,0,0,1,0,1,0,0,0,0,0,2,1,0,0,1,0,0,1,0,0,0,0,0,0,0,0,0,0,0,0,0,0,1,0,1,0,0,0,0,0,0,0,0,2,0,2,1,0,0,0,0,0,0,0,0,0,0,0,0,0,0,0,0,0,0,0,0,2,0,0,0,0,0,0,0,0,0,1,1
"Ireland/United Kingdom/(Northern Ireland)",Government/territory,62,"Northern Ireland peace process","Europe and Eurasia",122,1,"Joint Strategy for the Restoration of the Assembly and Executive",2006-04-06,"Multiparty signed/agreed",2,5862,InterIntra,Imp,ImpMod,"Tony Blair, then British Prime Minister, and Bertie Ahern, then Taoiseach (Irish Prime Minister)",,"Page 1, 1.
In recent months we have held discussions with all the political parties in Northern Ireland with a view to restoring the political institutions and building on the peace and prosperity which have flowed from the Good Friday Agreement.

Page 1, 2.
When we last met, we noted the historic progress represented by the IRA statement of July 2005...

Page 1, 4.
The Assembly will therefore be recalled on 15 May. Recognising that it has not sat for nearly four years, it seems sensible to give the Assembly a short period in which to prepare for government as envisaged by paragraph 35 of Strand One of the Good Friday Agreement...

Page 2, 10. 
...We are beginning detailed work on British-Irish partnership arrangements that will be necessary in these circumstances to ensure that the Good Friday Agreement, which is the indispensable framework for relations on and between these islands, is actively developed across its structures and functions...",GBR,IRL,200,205,315,,,,0,0,0,0,0,0,0,0,0,0,0,0,0,0,0,0,0,0,0,0,0,0,0,0,0,0,0,0,0,0,0,0,0,0,0,0,0,0,0,0,0,0,0,0,0,0,0,0,0,0,0,0,0,0,0,0,0,1,0,0,0,0,0,0,0,0,1,3,1,0,0,0,0,1,0,0,0,0,0,0,1,3,0,1,1,1,0,0,0,0,0,0,0,0,0,0,0,0,0,0,0,0,0,0,0,0,0,0,0,0,0,0,0,0,0,0,0,0,0,0,0,0,0,0,0,0,0,0,0,0,0,0,0,0,0,0,0,0,0,0,0,0,0,0,0,0,0,0,0,0,0,0,0,0,0,0,0,0,0,0,0,0,0,1,1,0,0,0,0,0,0,1,1,0,0,0,0,0,0,1,0,1,0,0,0,0,0,0,0,0,0,0,0,0,0,0,0,0,0,0,0,0,0,0,1,0,0,0,0,0,1,0,0,0,0,1,0,0,0,0,0,0,0,0,0,0,0,0,0,0,0,0,0,0,0,0,0,0,1,1
"Ireland/United Kingdom/(Northern Ireland)",Government/territory,62,"Northern Ireland peace process","Europe and Eurasia",123,1,"Joint Statement January 2006",2006-01-26,"Multiparty signed/agreed",2,3804,InterIntra,Pre,Prin,"Joint Statement by Bertie Ahern, then Taoiseach (Irish Prime Minister), and Tony Blair, then British Prime Minister",,,GBR,IRL,200,205,315,,,,0,0,0,0,0,0,0,0,0,0,0,0,0,0,0,0,0,0,0,0,0,0,0,0,0,0,0,0,0,0,0,0,0,0,0,0,0,0,0,0,0,0,0,0,0,0,0,0,0,0,0,0,0,0,0,0,0,1,0,0,0,0,0,0,0,0,1,1,1,0,0,0,0,0,0,0,0,0,0,0,0,0,0,0,0,0,0,0,0,0,0,0,0,0,0,0,0,0,0,0,0,0,0,0,0,0,0,1,1,0,0,0,1,0,0,0,0,0,0,0,0,0,0,0,0,0,0,0,0,0,0,0,0,0,0,0,0,0,0,0,0,0,0,0,0,0,0,0,0,0,0,0,0,0,0,0,0,0,0,0,0,0,0,0,0,0,0,0,0,0,0,0,0,0,0,0,0,0,0,0,0,0,0,0,0,0,0,0,0,0,0,0,0,1,1,0,0,0,0,0,0,0,0,0,1,0,2,0,1,0,1,0,0,0,0,0,0,0,0,0,0,0,0,0,0,0,0,0,0,0,0,0,0,0,0,0,0,0,0,1
"Ireland/United Kingdom/(Northern Ireland)",Government/territory,62,"Northern Ireland peace process","Europe and Eurasia",124,1,"Proposals for a Comprehensive Agreement",2004-12-08,"Agreement with subsequent status",18,7528,InterIntra,Imp,ImpOth,"UK government, Irish Government",,"Page 1, 3. 
The Governments have made clear consistently that they remain committed to the fundamentals of the Agreement reached in 1998, including the need for consent to constitutional change, for absolute commitment to exclusively peaceful and democratic means, for stable inclusive partnership government, for a balanced institutional accommodation of the key relationships within Northern Ireland, between North and South and between these islands and for equality and human rights to be at the heart of the new dispensation in Northern Ireland. None of the parties in the review of the operation of the Agreement conducted this year have dissented from these fundamental elements.",GBR,IRL,200,205,315,,,,0,0,0,0,0,0,0,0,0,0,0,0,0,0,0,0,0,0,0,0,0,0,0,0,0,0,0,0,0,0,0,0,0,0,0,0,0,0,0,0,0,0,0,0,0,0,0,0,0,0,0,0,0,0,0,0,0,1,0,0,0,0,0,0,0,0,1,2,1,0,0,3,0,0,0,0,0,0,1,0,0,3,0,1,1,1,0,1,0,0,0,0,0,0,0,0,0,0,0,0,0,0,0,0,0,1,2,0,0,0,0,0,0,0,0,0,0,0,0,0,0,0,0,0,0,0,0,0,0,0,0,0,0,0,0,0,0,0,0,0,0,0,0,0,0,0,0,0,0,0,0,0,0,0,0,0,0,0,0,0,0,0,0,1,1,1,0,1,0,0,0,0,0,0,0,0,0,0,0,0,0,0,0,0,0,0,0,0,0,0,0,0,0,0,0,0,0,0,0,0,0,0,0,0,2,0,2,1,0,0,1,0,0,0,0,0,0,0,0,0,0,0,0,0,0,0,0,0,0,0,0,0,0,0,0,0,0,0,1,1
"Ireland/United Kingdom/(Northern Ireland)",Government/territory,62,"Northern Ireland peace process","Europe and Eurasia",135,1,"Proposals in Relation to On the Runs",2003-05-01,"Multiparty signed/agreed",3,4692,InterIntra,Imp,ExtSub,"UK government, Irish Government",,,GBR,IRL,200,205,315,,,,0,0,0,0,0,0,0,0,0,0,0,0,0,0,0,0,0,0,0,0,0,0,0,0,0,0,0,0,0,0,0,0,0,0,0,0,0,0,0,0,0,0,0,0,0,0,0,0,0,0,0,0,0,0,0,0,0,0,0,0,0,0,0,0,0,0,0,0,0,0,0,0,0,0,0,0,0,0,0,0,0,0,0,0,0,0,0,0,0,0,0,0,0,0,0,0,0,0,0,0,0,0,0,0,0,0,0,0,0,0,0,0,0,0,0,0,0,0,1,0,0,0,0,0,0,0,0,0,1,0,0,0,0,0,0,0,0,0,0,0,0,0,0,0,0,0,0,0,0,0,0,0,0,0,0,0,0,0,0,0,0,0,0,1,1,1,0,0,1,0,0,0,0,0,0,0,0,0,0,0,0,0,0,0,0,0,0,0,0,0,0,0,0,0,0,0,0,0,0,0,0,0,0,0,0,0,0,0,0,0,0,0,0,0,0,1,0,1,0,1,0,0,3,1,0,0,0,0,1,0,0,0,0,0,0,0,0,0,0,1
"Ireland/United Kingdom/(Northern Ireland)",Government/territory,62,"Northern Ireland peace process","Europe and Eurasia",132,1,"Joint Declaration by the British and Irish Governments",2003-04-01,"Multiparty signed/agreed",22,57328,InterIntra,Imp,ImpMod,"British government, Irish Government",,"[Summary: The agreement in its entirety provides implementation modalities and commitments of the Good Friday Agreement.]

Page 4, Acts of Completion, 5.
The two Governments have previously stated their commitment to the full implementation of the Agreement which, we affirmed, had already brought great gains and tangible benefits to the people of Northern Ireland. The achievements of the Agreement have already vindicated the vision and courage of those who seized that opportunity. The Agreement remains the template for political progress, has been endorsed by the people of Ireland, North and South, and is the only sustainable basis for a fair and honourable accommodation between all traditions.",GBR,IRL,200,205,315,,,,1,1,0,0,0,2,0,1,0,0,0,0,0,0,0,0,0,0,0,0,3,1,0,1,0,3,0,1,1,0,0,0,0,0,0,0,0,0,0,0,0,0,0,0,2,0,1,0,0,1,0,0,0,0,0,0,0,1,0,0,0,0,1,0,0,0,1,2,1,0,0,0,1,0,0,0,0,0,1,0,0,0,0,0,0,0,0,0,0,0,0,0,0,0,0,0,0,0,0,0,0,0,0,0,0,1,3,1,2,0,0,1,1,3,1,1,1,0,1,0,0,1,0,0,0,0,0,0,0,0,1,1,0,0,0,0,0,0,0,0,0,0,0,2,1,0,0,0,0,0,0,1,0,3,0,1,0,0,0,0,0,0,0,1,1,1,0,0,1,1,0,3,1,0,0,0,0,0,0,0,0,0,0,0,0,0,0,0,1,0,1,0,0,1,1,1,1,0,0,0,1,0,0,0,3,3,2,1,0,0,1,0,0,0,0,1,1,0,0,0,0,0,0,0,0,0,0,0,2,0,1,0,1,1,0,0,0,0,1,1
"Ireland/United Kingdom/(Northern Ireland)",Government/territory,62,"Northern Ireland peace process","Europe and Eurasia",134,1,"Agreement between the British and Irish Governments: Monitoring and Compliance",2003-04-01,"Multiparty signed/agreed",4,6684,InterIntra,Imp,ImpMod,"UK government, Irish Government",,"Page 2, MONITORING AND COMPLIANCE, 1. 
On account of the divisive legacies of the past and the deficit of mutual confidence between both communities, we now judge it necessary to build various safeguards and assurance mechanisms into the proposals set out in the Joint Declaration...

Page 2, MONITORING AND COMPLIANCE, 2.
A new independent body will therefore be created that will monitor and report on the carrying out of the commitments relating to the ending of paramilitary activity and the programme of security normalisation, as set out in paragraphs 12-19 and Annex 1 of the Joint Declaration...",GBR,IRL,200,205,315,,,,0,0,0,0,0,0,0,0,0,0,0,0,0,0,0,0,0,0,0,0,0,0,0,0,0,0,0,0,0,0,0,0,0,0,0,0,0,0,0,0,0,0,0,0,0,0,0,0,0,0,0,0,0,0,0,0,0,0,0,0,0,0,0,0,0,0,0,0,0,0,0,0,0,0,0,0,0,0,0,0,0,0,0,0,0,0,0,0,0,0,0,0,0,0,0,0,0,0,0,0,0,0,0,0,0,0,0,0,0,0,0,0,0,0,0,0,0,0,0,0,0,0,0,0,0,0,0,0,0,0,0,0,0,0,0,0,0,0,0,0,0,0,0,0,0,0,0,0,0,0,0,0,0,0,0,0,0,0,0,0,0,0,0,1,0,1,0,0,0,0,0,0,0,0,0,0,0,0,0,0,0,0,0,0,0,0,0,0,0,0,0,0,0,0,0,0,0,0,0,0,0,0,0,0,1,2,1,1,0,0,1,0,0,0,0,1,0,0,0,0,0,0,0,0,0,0,0,0,0,0,0,0,0,0,0,0,0,0,1,1
"Ireland/United Kingdom/(Northern Ireland)",Government/territory,62,"Northern Ireland peace process","Europe and Eurasia",125,1,"Implementation of the Good Friday Agreement: Proposals by the Two Governments",2001-08-01,"Multiparty signed/agreed",6,14153,InterIntra,Imp,ExtSub,"Northern Ireland Office and Department of Foreign Affairs ",,"[Summary: The agreement in its entirity provides for implementing provisions of the Good Friday Agreement.]

Page 3, Proposals on normalisation, 14. 
As indicated in the two Governments’ statement of 5 May 2000, the British Government will progressively take all the necessary steps to secure as early a return as possible to normal security arrangements in Northern Ireland...",GBR,IRL,200,205,315,,,,0,0,0,0,0,0,0,0,0,0,0,0,0,0,0,0,0,0,0,0,0,0,0,0,0,0,0,0,0,0,0,0,0,0,0,0,0,0,0,0,0,0,0,0,0,0,0,0,0,0,0,0,0,0,0,0,1,1,0,0,0,0,0,0,0,0,1,1,1,0,0,0,3,0,0,0,0,0,0,0,0,0,0,0,0,0,0,0,0,0,0,0,0,0,0,0,0,0,0,0,0,0,0,0,0,0,1,1,0,0,0,0,0,0,0,0,0,0,0,0,0,0,0,0,0,0,0,0,0,0,0,0,0,0,0,0,0,0,0,0,0,0,0,0,0,0,0,0,0,0,0,0,0,0,0,0,0,0,0,0,0,0,0,1,0,1,0,0,0,0,0,1,1,0,0,0,0,0,0,0,0,0,0,0,0,0,0,0,0,0,0,0,0,1,0,0,1,0,1,0,0,0,0,0,2,2,1,1,0,0,0,0,0,0,0,1,0,2,0,1,0,0,2,1,0,0,2,0,2,0,2,0,1,0,0,0,0,0,1,1
"Ireland/United Kingdom/(Northern Ireland)",Government/territory,62,"Northern Ireland peace process","Europe and Eurasia",1267,1,"Joint Statement by Tony Blair and Bertie Ahern (Saturday afternoon statement)",2000-05-06,"Multiparty signed/agreed",1,1097,InterIntra,Imp,ExtSub,"British and Irish Governments (by the Prime Minister Tony Blair and the Taoiseach Bertie Ahern)",,,GBR,IRL,200,205,315,,,,0,0,0,0,0,0,0,0,0,0,0,0,0,0,0,0,0,0,0,0,0,0,0,0,0,0,0,0,0,0,0,0,0,0,0,0,0,0,0,0,0,0,0,0,0,0,0,0,0,0,0,0,0,0,0,0,0,0,0,0,0,0,0,0,0,0,0,0,0,0,0,0,0,0,0,0,0,0,0,0,0,0,0,0,0,0,0,0,0,0,0,0,0,0,0,0,0,0,0,0,0,0,0,0,0,0,0,0,0,0,0,0,0,0,0,0,0,0,0,0,0,0,0,0,0,0,0,0,0,0,0,0,0,0,0,0,0,0,0,0,0,0,0,0,0,0,0,0,0,0,0,0,0,0,0,0,0,0,0,0,0,0,0,0,0,0,0,0,0,0,0,0,0,0,0,0,0,0,0,0,0,0,0,0,0,0,0,0,0,0,0,0,0,0,0,0,0,0,0,0,0,0,0,0,0,0,2,1,0,0,0,0,0,0,0,0,0,0,0,0,0,0,0,0,0,0,0,0,0,0,0,0,0,0,0,0,0,0,0,1
"Ireland/United Kingdom/(Northern Ireland)",Government/territory,62,"Northern Ireland peace process","Europe and Eurasia",1269,1,"Letter from British and Irish governments to the political parties in Northern Ireland (Saturday morning)",2000-05-06,"Multiparty signed/agreed",2,3464,InterIntra,Imp,ExtSub,"British and Irish governments",,"Page 2, Prisoners
It is intended that, in accordance with the Good Friday agreement, all remaining prisoners qualifying for early release will be released by July 28th, 2000. Measures will continue to be taken to facilitate the reintegration of prisoners into the community, and to address related issues.",GBR,IRL,200,205,315,,,,0,0,0,0,0,0,0,0,0,0,0,0,0,0,0,0,0,0,0,0,0,0,0,0,0,0,0,0,0,0,0,0,0,0,0,0,0,0,0,0,0,0,0,0,0,0,0,0,0,0,0,0,0,0,0,0,0,0,0,0,0,0,0,0,0,0,0,0,0,0,0,0,0,0,0,0,0,0,0,0,0,0,0,0,0,0,0,0,0,0,0,0,0,0,0,0,0,0,0,0,0,0,0,0,0,0,3,0,0,0,0,0,0,1,0,0,1,0,0,0,0,0,0,0,0,0,0,0,0,0,0,0,0,0,0,0,0,0,0,0,0,0,0,1,1,0,0,0,0,0,0,0,0,3,0,1,0,0,0,0,0,0,0,1,0,1,0,0,0,0,0,0,0,0,0,0,0,0,0,0,0,0,0,0,0,0,0,0,0,0,0,0,0,1,0,1,0,0,0,0,0,0,0,0,2,0,0,0,0,0,1,0,0,0,0,0,0,0,0,0,0,0,0,0,0,0,2,0,1,0,0,0,0,0,0,0,0,0,0,1
