"Bosnia and Herzegovina/Yugoslavia (former)",Government/territory,125,"Bosnia peace process","Europe and Eurasia",1030,1,"Conclusions of the Peace Implementation Conference held at Lancaster House (London Conference)",1995-12-09,"Multiparty signed/agreed",11,29053,InterIntra,Pre,PreOth,"The Peace Implementation Council members: Albania, Austria, Belgium, Bosnia and Herzegovina, Bulgaria, Canada, China, Croatia, Czech Republic, Denmark, Egypt, Federal Republic of Yugoslavia, Finland, Former Yugoslav Republic of Macedonia, France, Germany, Greece, Hungary, Ireland, Italy, Japan, Jordan, Luxembourg, Malaysia, Morocco, Netherlands, Norway, Oman, Pakistan, Poland, Portugal, Romania, Russian Federation, Saudi Arabia, Slovak Republic, Slovenia, Spain, Sweden, Switzerland, Turkey, Ukraine, United Kingdom, United States of America, Council of Europe, European Bank for Reconstruction and Development (EBRD), European Commission, International Committee of the Red Cross (ICRC), International Criminal Tribunal for the former Yugoslavia (ICTY), International Monetary Fund (IMF), North Atlantic Treaty Organisation (NATO), Organisation for Security and Co-operation in Europe (OSCE), United Nations (UN), UN High Commissioner for Human Rights (UNHCHR), UN High Commissioner for Refugees (UNHCR), UN Transitional Administration of Eastern Slavonia (UNTAES) and the World Bank.",,"Page 1, 1. 
The General Framework Agreement for Peace in Bosnia and Herzegovina initialled at Dayton, Ohio, United States of America, on 21 November 1995 by the Republic of Bosnia and Herzegovina, the Republic of Croatia and the Federal Republic of Yugoslavia (see A/50/790-S/1995/999) provides the population of Bosnia and Herzegovina with the opportunity to rebuild their lives together in peace and prosperity...

Page 1, 2. 
The Peace Agreement will be signed at the Paris Conference on 14 December 1995. That Conference will mark a further important stage in bringing about recognition between the States in the region and will initiate promotion of good neighbourly relations between them.

Page 1, 3. 
The purpose of the London Peace Implementation Conference is to mobilize the international community behind a new start for the people of Bosnia and Herzegovina. The Conference agrees that the peace should result in:...(h) Successful implementation of the Basic Agreement on the region of Eastern Slavonia, Baranja and Western Sirmium;

Page 2-3, Military implementation 8.
The military mission was described as having the following primary tasks: (a) To ensure continued compliance with the Cessation-of-Hostilities Agreement;

Page 3, Military implementation, 9. 
General Joulwan said that, in addition to these key tasks, IFOR might be asked to undertake the following supporting tasks within the limits of its capabilities: (a) To help create secure conditions for the conduct by others of other tasks associated with the Peace Agreement (though IFOR would not undertake humanitarian tasks itself);

Page 3, Regional stabilization, 12. 
The Conference therefore strongly: (a) Urges the parties to observe the deadlines set out in the Peace Agreement for agreeing on such measures;

Page 4, Civilian implementation, 14. 
Mr. Bildt identified in particular the need for early action in Sarajevo to create confidence between the communities. Bosnia and Herzegovina has requested the cooperation of the High Representative in the project of a unified Sarajevo as the capital of Bosnia and Herzegovina and of the Federation of Bosnia and Herzegovina as called for by the Peace Agreement...

Page 4, High Representative, 18. 
Following consultation with the Government of Bosnia the Conference approved the designation of Mr. Carl Bildt as High Representative and expressed gratitude for his willingness to take on this responsibility. It notes that Mr. Bildt will continue to act as EU Mediator for Former Yugoslavia and in that capacity will work closely with the EU Troika. The Conference invites the United Nations Security Council to agree to Mr. Bildt’s designation as High Representative.

Page 5, Administrative structures for civilian implementation, 20. 
The Conference concludes that, with the signature of the Peace Agreement, important objectives of the International Conference on the Former Yugoslavia have been met and a new structure is required to manage peace implementation.

Page 6, Humanitarian assistance, refugees and prisoners, 23. 
The war in Bosnia and Herzegovina has involved great suffering among the civilian population. Over 2.1 million people have been displaced or become refugees. The Conference acknowledges the great contribution made during the conflict by UNHCR and other humanitarian agencies, funded in large part by EU, as well as the support given in the countries of asylum. It agrees that an early objective of the Peace Agreement is to create secure conditions for the safe and orderly return of refugees and displaced persons to places of their choice.

Page 7, Humanitarian assistance, refugees and prisoners, 25.
The President of the International Committee of the Red Cross (ICRC) drew attention to the Committee’s tasks in respect of prisoners and missing persons. Fulfilment of the Peace Agreement will require: ...(b) Full cooperation of the parties over the release of prisoners and the provision of information about the fate of persons unaccounted for, as set out in the Peace Agreement.

Page 7, Humanitarian assistance, refugees and prisoners, 27. 
The parties undertake to comply urgently and fully with their obligations in creating the conditions necessary for the early, safe and orderly return of refugees and to cooperate fully with ICRC to ensure the early release of prisoners in accordance with the Peace Agreement.

Page 7, Protection of human rights, 30. 
The Conference takes note of the commitments made by the parties in the Peace Agreement...

Page 8, Protection of human rights, 31. 
The Conference underlines the relationship between the fulfilment by the parties of their commitments in the Peace Agreement, including the observance of the highest standards of human rights and the readiness of the international community to commit financial resources for reconstruction and development.

Page 8, Protection of human rights, 32. 
The Conference decides that, in view of the human rights situation in Bosnia and Herzegovina, urgent action is needed in the following areas:...(c) OSCE should appoint an ombudsman, as provided for in the Peace Agreement; (d) The relevant Council of Europe organs should appoint members of the constitutional court for Bosnia and Herzegovina and the human rights chamber, as provided for in the Peace Agreement;

Page 8, Protection of human rights, 33. 
The Conference agrees that the High Representative or his representative will chair a human rights task force in Sarajevo, bringing together the organizations and agencies involved in the implementation of the Peace Agreement.

Page 8, Elections, 34. 
The Conference notes that, between six and nine months after signature of the Peace Agreement, elections supervised by a provisional election commission established by OSCE will be held in Bosnia and Herzegovina. These elections are of paramount importance in bringing about a democratic and stable country.

Page 11, Eastern Slavonia, 46. 
An informal meeting involving a number of delegations closely concerned was held in the margins of the Conference to discuss the implementation of the Basic Agreement on the region of Eastern Slavonia, Baranja and Western Sirmium.

Page 11, Eastern Slavonia, 47. 
There was recognition of the crucial importance of successful implementation of this Agreement. The international community will play its part. The United Nations Secretary-General will issue a report by 14 December. The United States of America declared its readiness to nominate a candidate to head the Transitional Administration, which will govern the region during the transitional period for which the Basic Agreement provides. It was agreed that no effort should be spared to find and deploy quickly adequate international forces required for the transitional period.

",BIH,,346,,389,,,215,0,0,0,0,0,0,0,0,0,0,0,0,0,0,0,0,0,0,0,0,1,1,0,0,0,0,0,0,0,0,0,0,0,0,0,0,0,0,0,0,2,1,0,0,0,0,0,0,0,0,0,0,0,0,0,0,0,1,1,0,0,0,1,1,0,0,1,0,0,0,0,0,3,3,0,0,0,0,1,0,0,0,0,0,0,0,0,0,0,0,0,0,0,0,0,0,0,0,0,0,0,0,0,0,0,1,0,1,3,1,0,1,0,3,1,0,1,0,1,0,0,0,0,0,0,0,0,0,0,0,1,1,0,0,0,0,0,0,0,0,0,0,0,3,0,1,0,0,0,0,0,1,0,1,0,1,0,0,0,0,0,0,0,0,0,0,0,0,1,0,0,1,1,0,0,0,0,1,2,0,0,0,0,0,0,0,0,0,0,0,0,0,0,0,0,0,0,0,0,0,1,2,1,0,1,0,1,1,0,0,0,0,0,0,0,0,0,0,0,0,0,0,1,0,1,0,2,0,0,2,0,0,0,2,1,0,0,1,1,1
"Bosnia and Herzegovina/Yugoslavia (former)",Government/territory,125,"Bosnia peace process","Europe and Eurasia",1289,1,"Agreement on Initialling the General Framework Agreement for Peace in Bosnia and Herzegovina",1995-11-21,"Multiparty signed/agreed",1,1825,Intra,Imp,ImpMod,"The Republic of Bosnia and Herzegovina, the Republic of Croatia and the Federal Republic of Yugoslavia ",,"Page 1, Article I
The negotiation of the General Framework Agreement for Peace in Bosnia and Herzegovina and its Annexes has been completed. The Parties, and the Entities that they represent, commit themselves to signature of these Agreements in Paris in their present form, in accordance with Article III, thus establishing their entry into force and the date from which the Agreements shall have operative effect.

Page 1, Article II
The initialling of each signature block of the General Framework Agreement for Peace in Bosnia and Herzegovina and its Annexes today hereby expresses the consent of the Parties, and the Entities that they represent, to be bound by such Agreements.

Page 1, Article III
Prior to signature of the General Framework Agreement for Peace in Bosnia and Herzegovina in Paris, the Annexes may be renumbered, with the necessary conforming changes made.

Page 1, Article IV
This Agreement shall enter into force upon signature.",BIH,,346,,389,,,215,0,0,0,0,0,0,0,0,0,0,0,0,0,0,0,0,0,0,0,0,0,0,0,0,0,0,0,0,0,0,0,0,0,0,0,0,0,0,0,0,0,0,0,0,0,0,0,0,0,0,0,0,0,0,0,0,0,0,0,0,0,0,0,0,0,0,0,0,0,0,0,0,0,0,0,0,0,0,0,0,0,0,0,0,0,0,0,0,0,0,0,0,0,0,0,0,0,0,0,0,0,0,0,0,0,0,0,0,0,0,0,0,0,0,0,0,0,0,0,0,0,0,0,0,0,0,0,0,0,0,0,0,0,0,0,0,0,0,0,0,0,0,0,0,0,0,0,0,0,0,0,0,0,0,0,0,0,0,0,0,0,0,0,0,0,0,0,0,0,0,0,0,0,0,0,0,0,0,0,0,0,0,0,0,0,0,0,0,0,0,0,0,0,0,0,0,0,0,0,0,0,0,0,0,0,0,0,0,0,0,0,0,0,0,0,0,0,0,0,0,0,0,0,0,0,0,0,0,0,0,0,0,0,0,0,0,0,0,0,1
"Bosnia and Herzegovina/Yugoslavia (former)",Government/territory,125,"Bosnia peace process","Europe and Eurasia",389,1,"General Framework Agreement for Peace in Bosnia and Herzegovina (Dayton Peace Agreement)",1995-11-21,"Multiparty signed/agreed",149,197656,Intra,SubComp,FrAg,"Main Agreement: Signed on behalf of the Republic of Bosnia and Herzegovina; Republic of Croatia, Federal Republic of Yugoslavia; 

Annex 1-A: Signed on behalf of the Republic of Bosnia and Herzegovina; Republic of Croatia, Federal Republic of Yugoslavia;

Annex 1-B signed by Republic of Bosnia and Herzegovina and North Atlantic Treaty Organisation (with letters of support from Federal Republic of Yugoslavia; Federation of Bosnia and Herzegovina; Republika Srpska; and (with additional clauses), Republic of Croatia; (with additional clauses) Federal Republic of Yugoslavia

Annex 2 signed on behalf of the Republic of Bosnia and Herzegovina; Republic of Croatia, Federal Republic of Yugoslavia; Federation of Bosnia and Herzegovina; and Republika Srpska; 

Annex 3 signed on behalf of the Republic of Bosnia and Herzegovina; Republic of Croatia, Federal Republic of Yugoslavia; Federation of Bosnia and Herzegovina; and Republika Srpska;  Map appendix signed by Republic of Bosnia and Herzegovina; Republic of Croatia and Federal Republic of Yugoslavia; 

Annex 3 signed on behalf of the Republic of Bosnia and Herzegovina; Federation of Bosnia and Herzegovina; and Republika Srpska;

Annex 4 unsigned by with three Declarations in Support by Republic of Bosnia and Herzegovina; Republika Srpska and Federation of Bosnia and Herzegovina (on behalf of Croat and Bosniak constituent peoples);

Annex 5 signed on behalf of Federation of Bosnia and Herzegovina and Republika Srpska; 

Annex 6 signed on behalf of the Republic of Bosnia and Herzegovina; Federation of Bosnia and Herzegovina; and Republika Srpska;

Annex 7 signed on behalf of the Republic of Bosnia and Herzegovina; Federation of Bosnia and Herzegovina; and Republika Srpska;

Annex 8 signed on behalf of the Republic of Bosnia and Herzegovina; Federation of Bosnia and Herzegovina; and Republika Srpska;

Annex 9 signed on behalf of Federation of Bosnia and Herzegovina and Republika Srpska; 

Annex 10 signed on behalf of the Republic of Bosnia and Herzegovina; Republic of Croatia, Federal Republic of Yugoslavia; Federation of Bosnia and Herzegovina; and Republika Srpska; 

Annex 11 Republic of Bosnia and Herzegovina; Republic of Croatia, Federal Republic of Yugoslavia;



","General Framework Agreement for Peace in Bosnia and Herzegovina (Main Agreement), witnessed by representatives of: European Union Special Negotiator, the French Republic, the Federal Republic of Germany, the Russian Federation (except for annex 1), the United Kingdom of Great Britain and Northern Ireland, the United States of America
","Page 8, Annex 1-A, Agreement on the Military Aspects of the Peace Agreement, Article II, Cessation of Hostilities, 1. 
The Parties shall comply with the cessation of hostilities begun with the agreement of October 5, 1995 and shall, continue to refrain from all offensive operations of any type against each other.

Page 59, Annex 4: Constitution of Bosnia and Herzegovina, Untitled Preamble
...Recalling the Basic Principles agreed in Geneva on September 8, 1995, and in New York on September 26, 1995,...

Page 81, Annex 5: Agreement on Arbitration
The Federation of Bosnia and Herzegovina and the Republika Srpska agree to honor the following obligations as set forth in the Agreed Basic Principles adopted at Geneva on September 8, 1995, by the Republic of Bosnia and Herzegovina, the Republic of Croatia,
and the Federal Republic of Yugoslavia, the latter representing also the Republika Srpska:...",BIH,,346,,389,1073,6,215,2,0,0,1,0,0,0,0,0,0,0,0,0,0,0,2,0,0,1,0,3,1,1,1,0,3,1,1,1,0,0,0,0,0,0,0,0,0,0,0,3,0,1,0,2,0,1,0,0,1,0,0,0,0,0,0,1,1,1,1,0,0,1,0,0,1,0,3,0,1,0,0,3,3,2,1,0,1,1,0,0,3,1,0,1,1,1,1,0,1,0,3,1,0,0,1,2,1,0,0,3,0,1,0,0,1,3,1,3,1,1,1,1,3,0,1,1,0,1,1,1,0,1,1,1,1,0,1,1,1,0,1,0,1,1,0,0,1,0,0,0,0,0,3,0,1,0,3,1,0,0,1,0,3,1,1,1,0,3,1,1,1,0,0,0,0,0,0,1,1,0,3,1,1,1,1,0,0,2,3,0,1,0,1,1,0,0,0,1,1,1,0,0,1,0,1,1,0,0,1,0,3,1,0,3,2,3,1,0,0,1,1,0,0,0,0,0,3,1,0,0,0,1,0,1,0,3,0,2,2,0,0,0,1,0,1,0,1,1,1
"Bosnia and Herzegovina/Yugoslavia (former)",Government/territory,125,"Bosnia peace process","Europe and Eurasia",2,1,"Dayton Agreement on Implementing the Federation of Bosnia and Herzegovina, Dayton",1995-11-10,"Multiparty signed/agreed",14,23370,Intra,Imp,ImpMod,"To the Dayton Agreement on Implementing the Federation of Bosnia and Herzegovina:
Alija Izetbegovic, President of the Republic of Bosnia and Herzegovina; Kresimir Zubik, President of the Federation of Bosnia and Herzegovina; Dr. Haris Silajdzic, Prime Minister; Jadranko Prlic, Deputy Prime Minister 

To the signed Annex to the Dayton Agreement on Implementing the Federation of Bosnia and Herzegovina - Agreed Principles for the Interim Statute for the City of Mostar:
Mijo Brajkovic, Mayor of West Mostar; Hans Koachnik, EU Admininstrator; Safet Orucevic, Mayor of East Mostar 

To the Dayton Agreement on Implementing the Federation of Bosnia and Herzegovina:
Endorsed by: Dr. Franjo Tudjman, President of the Republic of Croatia","Witnessed by: Ambassador Wolfgang Ischinger, Federal Republic of Germany; Ambassador Richard Holbrooke, United States of America; Ambassador Fernandez de la Pena, Spanish EU Presidency; Hans Koschnick, EU Administrator Mostar  

To the signed Annex to the Dayton Agreement on Implementing the Federation of Bosnia and Herzegovina - Agreed Principles for the Interim Statute for the City of Mostar:
Muhamed Sacirbey, Minister of Foreign Affairs of the Republic of Bosnia and Herzegovina; Gojko Susak, Minister of Defense of the Republic of Croatia; Ambassador Wolfgang Ischinger, Federal Republic of Germany; Ambassador Fernandez de la Pena, Spanish EU Presidency
","Page 7, Ambassadors
Within one month after the adoption of the legislation referred to in section II A, we
shall implement the agreements reached in Zagreb on 11 September 1994 and at the Petersberg on 10 March 1995 regarding the appointment of Ambassadors.

Page 8, I. Mostar 
The Memorandum of Understanding for the EU Administration of 6 July 1994 shall be fully implemented.

Page 12, Annex: Agreed Principles for the Interim Statute for the City of Mostar
3. The City of Mostar shall be composed of six separate City-Municipalities. The boundaries of these City-Municipalities shall be defined in the Interim Statute for the City of Mostar.",BIH,,346,,398,,,215,3,0,0,1,0,0,0,0,0,0,0,0,0,0,0,0,0,0,0,0,0,0,0,0,0,0,0,0,0,0,0,0,0,0,0,0,0,0,0,0,3,0,1,0,0,0,0,0,0,1,1,1,0,0,0,0,0,1,0,1,0,0,1,0,0,0,0,3,0,1,1,3,0,2,0,0,0,0,0,0,2,2,0,1,0,1,1,0,0,1,0,3,1,1,0,1,0,0,0,0,2,0,1,1,0,0,0,0,0,0,0,0,0,0,0,0,0,0,0,0,0,0,0,0,0,0,0,0,0,0,0,0,0,0,0,0,0,0,0,0,0,0,0,0,0,0,0,0,0,0,0,1,0,2,1,0,0,0,1,1,1,0,0,1,0,1,0,0,0,0,0,1,1,0,0,0,1,1,2,3,1,0,0,1,1,1,1,0,0,0,0,0,0,0,0,0,0,0,1,0,0,0,0,0,2,3,0,0,0,0,1,0,0,1,0,0,0,0,0,0,0,0,0,0,0,0,0,0,0,0,0,0,0,0,0,1,0,0,0,1
"Bosnia and Herzegovina/Yugoslavia (former)",Government/territory,125,"Bosnia peace process","Europe and Eurasia",1201,1,"Trilateral New York Declaration of Bosnia and Herzegovina, Croatia and Turkey",1995-10-23,"Multiparty signed/agreed",1,3498,InterIntra,Ren,Repre,"Alija Izetbegovic, President of the Republic of Bosnia and Herzegovina; Franjo Tudjman, President of the Republic of Croatia; Süleyman Demirel, President of the Republic of Turkey",,"Page 1
...The Presidents emphasized their commitment to the Contact Group peace proposal and the Agreed Basic Principles of New York and Geneva and reiterated their firm belief that the Federation of Bosnia and Herzegovina should provide the basis for a peaceful solution to the crisis in Bosnia and Herzegovina...

Page 1
...They welcomed the signing of the Agreement on the Establishment of the Mission of Goodwill and Joint Police Forces for Action ""Return"" as a concrete result of the trilateral mechanism...",BIH,,346,,398,,,215,0,0,0,0,0,0,0,0,0,0,0,0,0,0,0,0,0,0,0,0,1,1,0,0,0,0,0,0,0,0,0,0,0,0,0,0,0,0,0,0,1,1,0,0,0,0,0,0,0,0,0,0,0,0,0,0,0,1,1,0,0,0,0,1,0,1,0,0,0,0,0,0,1,0,0,0,0,0,0,0,0,0,0,0,0,0,0,0,0,0,0,1,1,0,0,0,0,0,0,0,0,0,0,0,0,0,0,1,0,0,0,0,0,0,0,0,0,0,0,0,0,0,0,0,0,0,0,0,0,0,0,0,0,0,0,0,0,0,0,0,0,0,0,0,0,0,0,0,0,0,0,0,0,0,0,0,0,0,0,0,0,0,0,0,0,0,0,0,0,0,0,1,0,1,1,0,0,0,0,0,0,0,0,0,0,0,0,0,0,0,0,0,0,0,0,0,0,0,0,0,0,0,0,0,0,0,0,0,0,0,0,0,0,0,0,0,0,0,0,0,0,0,0,0,0,0,0,0,0,0,0,0,0,0,0,0,0,0,0,1
"Bosnia and Herzegovina/Yugoslavia (former)",Government/territory,125,"Bosnia peace process","Europe and Eurasia",1645,2,"Declaration (unilateral ceasefire implementation)",1995-10-11,"Unilateral document",1,490,Intra,Cea,Ceas,"Dr Hasan Muratovic, Minister [Republic and Federation of Bosnia and Herzegovina]",,"Page 1, 
The Republic and Federation of Bosnia and Herzegovina agrees that ceasefire agreement of 5 October will enter into force at 0001 hours on 12 October 1995, subject to a similar undertaking by the other side. Should the undertaking by the other side not be received by 1600 hours today, the entry into force will be at 0001 hours on 13 October 1995. ",BIH,,346,,389,,,215,0,0,0,0,0,0,0,0,0,0,0,0,0,0,0,0,0,0,0,0,0,0,0,0,0,0,0,0,0,0,0,0,0,0,0,0,0,0,0,0,0,0,0,0,0,0,0,0,0,0,0,0,0,0,0,0,0,0,0,0,0,0,0,0,0,0,0,0,0,0,0,0,0,0,0,0,0,0,0,0,0,0,0,0,0,0,0,0,0,0,0,0,0,0,0,0,0,0,0,0,0,0,0,0,0,0,0,0,0,0,0,0,0,0,0,0,0,0,0,0,0,0,0,0,0,0,0,0,0,0,0,0,0,0,0,0,0,0,0,0,0,0,0,0,0,0,0,0,0,0,0,0,0,0,0,0,0,0,0,0,0,0,0,0,0,0,0,0,0,0,0,0,0,0,0,0,0,0,0,0,0,0,0,0,0,0,0,0,0,0,0,0,0,0,0,0,0,0,0,0,0,1,1,0,0,0,0,0,0,0,0,0,0,0,0,0,0,0,0,0,0,0,0,0,0,0,0,0,0,0,0,0,0,0,0,0,0,0,0,1
"Bosnia and Herzegovina/Yugoslavia (former)",Government/territory,125,"Bosnia peace process","Europe and Eurasia",322,1,"Ceasefire Agreement for Bosnia and Herzegovina",1995-10-05,"Multiparty signed/agreed",2,3023,Intra,Cea,Ceas,"For the Republic of Bosnia and Herzegovina, and for the Federation of Bosnia and Herzegovina: A. IZETBEGOVIC; For Republika Srpska: Radovan KARADZIC, R. MLADIC","Witness: US Ambassador John Menzies, and Slobodan Milosevic","Page 1, 3. 
In order to allow for the negotiation and the commencement of the implementation of a Peace Agreement, this cease-fire will last for 60 days or until completion of proximity peace talks and a peace conference, whichever is later.

Page 1-2, 8. 
During the period of the cease-fire, the undersigned will fully honour the obligations undertaken through the Geneva Agreed Basic Principles of 8 September 1995, the Framework Agreement of 14 September 1995, and the Further Agreed Principles of 26 September 1995, including (without limiting the generality of the foregoing) the obligation to afford all persons freedom of movement and all displaced persons the right to return home and repossess their property.",BIH,,346,,389,,,215,0,0,0,0,0,0,0,0,0,0,0,0,0,0,0,0,0,0,0,0,0,0,0,0,0,0,0,0,0,0,0,0,0,0,0,0,0,0,0,0,1,0,1,0,0,0,0,0,0,0,0,0,0,0,0,0,0,0,0,0,0,0,0,0,0,0,0,0,0,0,0,0,0,0,0,0,0,0,0,0,0,0,0,0,0,0,0,0,0,0,0,0,0,0,0,0,0,0,0,0,0,0,0,0,0,0,0,0,1,1,0,0,0,0,0,0,0,0,0,0,0,0,0,0,0,0,0,0,0,0,0,0,0,0,0,0,0,0,0,0,0,0,0,0,0,0,0,0,0,0,0,1,0,0,0,0,0,0,0,0,0,0,0,0,0,0,0,0,0,0,0,0,0,0,0,0,0,0,0,0,0,0,0,0,0,0,0,0,0,0,0,0,0,0,0,0,0,0,0,0,0,3,1,0,0,0,0,0,0,0,0,0,0,0,0,0,0,0,0,0,0,0,0,0,0,0,2,0,0,0,0,0,0,0,0,0,0,1,0,1
"Bosnia and Herzegovina/Yugoslavia (former)",Government/territory,125,"Bosnia peace process","Europe and Eurasia",78,1,"Further Agreed Basic Principles (additional to those issued 8 September 1995, in Geneva)",1995-09-26,"Multiparty signed/agreed",2,3754,Intra,Pre,Prin,"H.E. Mr. Muhamed Sacirbey, Foreign Minister of the Republic of Bosnia and Herzegovina (Bosnia and Herzegovina); H.E. Mr. Mate Granic, Foreign Minister of the Republic of Croatia (Croatia); and H.E. Mr. Milan Milutinovic, Foreign Minister of the Federal Republic of Yugoslavia (Yugoslavia)","Witnessed by: the Permanent Representatives of France, Germany, Italy, the Russian Federation, the United Kingdom of Great Britain and Northern Ireland, and the United States of America to the United Nations","Page 1, 5.2
5.2 As soon as possible the Organization for Security and Cooperation in Europe (OSCE)(or other international organization) will station representatives in all principal towns throughout the Federation and the Republika Srpska in Bosnia and Herzegovina and publish monthly reports as to the degree to which (a) the obligations listed in all of the Agreed Basic Principles have been fulfilled, and (b) social conditions are being restored to a level at which the election process may be effective.

Page 2, 6.4
A constitutional court with jurisdiction to decide all questions arising under the Constitution of Bosnia and Herzegovina as it will be revised in accordance with all of the Agreed Basic Principles.

Page 2, 6.6
The foregoing institutions will have responsibility for the foreign policy of Bosnia and Herzegovina. The parties will negotiate further to determine the extent to which these institutions will also have responsibility for other matters consistent with all of the Agreed Basic Principles.",BIH,,346,,389,1569,,215,0,0,0,0,0,0,0,0,0,0,0,0,0,0,0,0,0,0,0,0,0,0,0,0,0,0,0,0,0,0,0,0,0,0,0,0,0,0,0,0,1,1,0,0,0,0,0,0,0,0,0,0,0,0,0,0,0,0,0,0,0,0,0,0,0,0,0,2,0,1,0,0,2,2,0,0,0,0,0,0,0,3,1,0,1,1,0,1,0,0,0,0,0,0,0,0,0,0,0,0,0,0,0,0,0,1,0,2,2,0,0,1,0,3,1,0,1,0,1,0,0,0,0,0,0,0,0,0,0,0,0,1,0,0,0,0,0,0,0,0,0,0,0,0,0,0,0,0,0,0,0,1,0,1,0,1,0,0,0,0,0,0,0,0,0,0,0,0,1,0,0,0,0,0,0,0,0,0,0,0,0,0,0,0,0,0,0,0,0,0,0,0,0,0,0,0,0,0,0,0,0,0,0,0,0,0,0,0,0,0,0,0,0,0,0,0,0,0,0,0,0,0,0,0,0,0,0,0,0,0,0,0,0,0,0,0,0,1,1,1
