"Bosnia and Herzegovina/Yugoslavia (former)",Government/territory,125,"Bosnia peace process","Europe and Eurasia",1165,1,"Confidence, Security-building and Verification (The London Conference)",1992-08-27,"Multiparty signed/agreed",3,6501,InterIntra,Cea,Rel,"This conference was convened by Great Britain, which held the presidency of the EC at the time. The Participants were: The SFRY republics, the EC countries, the USA, China, Russia, Japan, Canada, The Republic of Czechoslovakia (as a state which held the presidency of CSCE – Commission on Security and Cooperation in Europe) and the neighboring countries: Austria, Hungary, Romania, Bulgaria, Albania",,"Page 3, III Working Group Programme, 8
Although the group will focus on new measures, it will also be important to ensure that existing obligations under the terms at the Vienna Document 92 in respect of provision of information are fully implemented. Consideration should also be given to applying in the former SFRY some of the mechanisms of the Vienna Document which are designed to enhance transparency, for example the unusual military activity, verification and border tours measures.",BIH,,346,,389,,,215,0,0,0,0,0,0,0,0,0,0,0,0,0,0,0,0,0,0,0,0,0,0,0,0,0,0,0,0,0,0,0,0,0,0,0,0,0,0,0,0,1,0,1,0,0,0,0,0,0,0,0,0,0,0,0,0,0,0,0,0,0,0,0,0,0,0,0,0,0,0,0,0,0,0,0,0,0,0,1,0,0,0,0,0,0,0,0,0,0,0,0,0,0,0,0,0,0,0,0,0,0,0,0,0,0,0,0,0,0,0,0,0,0,0,0,0,0,0,0,0,0,0,0,0,0,0,0,0,0,0,0,0,0,0,0,0,0,0,0,0,0,0,0,0,0,0,0,0,0,0,0,0,0,0,0,0,0,0,0,0,0,0,0,0,0,0,0,0,0,0,0,2,0,1,0,0,0,0,0,0,0,0,0,0,0,0,0,0,0,0,0,0,0,0,0,0,0,0,0,0,0,1,0,1,0,0,2,1,0,0,1,0,0,0,0,0,0,0,0,0,0,0,0,0,0,0,1,0,0,0,0,0,0,0,1,1,0,1,0,1
"Bosnia and Herzegovina/Yugoslavia (former)",Government/territory,125,"Bosnia peace process","Europe and Eurasia",1166,1,"Conclusions on Implementation of Existing Sanctions, International Conference on Yugoslavia (The London Conference)",1992-08-27,"Multiparty signed/agreed",2,5135,InterIntra,Imp,ImpMod,"This was convened by Great Britain, which held the presidency of the EC at the time. The Participants were: The SFRY republics, the EC countries, the USA, China, Russia, Japan, Canada, The Republic of Czechoslovakia (as a state which held the presidency of CSCE – Commission on Security and Cooperation in Europe) and the neighboring countries: Austria, Hungary, Romania, Bulgaria, Albania",,"Page 1, 1. 
The London conference welcomes the steps taken by the international community to implement United Nations Security council Resolutions 713 and 757 imposing mandatory sanctions against Serbia and Montenegro, but regrets that there remain gaps in implementation. The following proposals deal with the gaps identified so far.

Page 1, Compliance with UNSCR 757: need for enforcement, 2. 
The Conference notes that many countries are cooperating with the UN Sanctions Committee but is concerned that compliance remains incomplete. The Conference calls on all governments forthwith to comply fully with the requirements of UNSCR 757. All governments should respond to the appeal issued by the UN Sanctions Committee for information regarding violations of the sanctions regime.

Page 1, Compliance with UNSCR 757: need for enforcement, 3.
The Conference recommends that the Security Council should consider any requests made to it under Article 50 of the UN Charter by any state which considers that it is confronted by special economic problems arising from carrying out the requirements of UNSCR 757.

Page 2, The Danube, 5.
The Conference notes that Article 103 of the UN Charter obliges the riparian states of the Danube to do whatever is necessary, including the stopping and searching of vessels, to prevent the use of the River Danube for the purposes of circumventing or breaking the sanctions imposed in UNSCR Resolutions 713 and 757, notwithstanding the provisions of the Belgrade Convention.

Page 2, Unauthorised transfers of Serbian and Montenegrin assets, 7. 
The Conference is concerned that financial transfers for the benefit of Serbia and Montenegro in breach of UNSCR 757 are taking place. The Conference countries reaffirm their commitment to prevent such transfers and call on other states to do the same. The conference invites the UN  Sanctions Committee to consider whether its guidelines need to be tightened for this purpose.

Page 2, Strengthening the legal framework, 9. 
The Conference invites the Security Council to take such further measures as may be necessary to ensure the full implementation of UNSCRs 713 and 757. Existing sanctions are possibly being breached by maritime traffic in the Adriatic Sea. The Security council is therefore invited to consider further measures to ensure rigorous implementation of sanctions in the Adriatic.",BIH,,346,,389,,,215,0,0,0,0,0,0,0,0,0,0,0,0,0,0,0,0,0,0,0,0,0,0,0,0,0,0,0,0,0,0,0,0,0,0,0,0,0,0,0,0,0,0,0,0,0,0,0,0,0,0,0,0,0,0,0,0,0,0,0,0,0,0,0,0,0,0,0,0,0,0,0,0,0,0,0,0,0,0,0,0,0,0,0,0,0,0,0,0,0,0,0,0,0,0,0,0,0,0,0,0,0,0,0,0,0,0,0,0,0,0,0,0,0,0,0,0,0,0,0,0,0,0,0,0,0,0,0,0,0,0,0,0,0,0,0,0,0,0,0,0,0,0,0,0,0,0,0,0,0,0,0,0,0,0,0,0,0,0,0,0,0,0,0,0,0,0,0,0,0,0,0,0,0,0,0,0,0,0,1,0,0,0,0,0,0,0,0,0,0,0,0,0,0,0,0,0,0,0,0,1,0,0,0,0,0,0,0,0,0,0,0,0,0,1,0,0,0,0,0,0,0,0,0,0,0,0,0,0,0,0,0,0,0,0,1,0,0,0,0,1
"Bosnia and Herzegovina/Yugoslavia (former)",Government/territory,125,"Bosnia peace process","Europe and Eurasia",1167,1,"Specific Decisions by the London Conference, International Conference on Former Yugoslavia (The London Conference)",1992-08-27,"Multiparty signed/agreed",3,5866,InterIntra,Pre,Prin,"This conference was convened by Great Britain, which held the presidency of the EC at the time. The Participants were: The SFRY republics, the EC countries, the USA, China, Russia, Japan, Canada, The Republic of Czechoslovakia (as a state which held the presidency of CSCE – Commission on Security and Cooperation in Europe) and the neighboring countries: Austria, Hungary, Romania, Bulgaria, Albania",,"Page 1, 1
Acting under the principles set out in the relevant Conference documents, all parties at the conference formally accept and agree to cooperate in a number of actions.

Page 2, International Action, 6
In order to promote these objectives all governments and international organisations will:
- collaborate fully with the Secretary General of the United Nations in providing to him information in implementation of UNSCR 771",BIH,,346,,389,,,215,0,0,0,0,0,0,0,0,0,0,0,0,0,0,0,0,0,0,0,0,0,0,0,0,0,0,0,0,0,0,0,0,0,0,0,0,0,0,0,0,1,0,1,0,0,0,0,0,0,0,0,0,0,0,0,0,0,0,0,0,0,0,0,0,0,0,0,0,0,0,0,0,0,0,0,0,0,0,1,0,0,0,0,0,0,0,0,0,0,0,0,0,0,0,0,0,0,0,0,0,0,0,0,0,0,0,0,0,0,0,0,0,0,3,0,0,1,0,0,0,0,0,0,0,0,0,0,0,0,0,0,0,0,0,0,0,0,0,0,0,0,0,0,0,0,0,0,0,0,0,0,1,0,0,0,0,0,0,0,0,0,0,0,0,0,0,0,0,0,1,0,2,0,1,0,0,0,1,1,0,0,0,0,0,0,0,0,0,0,0,0,0,0,0,0,0,0,0,0,1,0,1,0,1,0,2,1,1,0,0,1,0,0,0,0,0,0,0,0,0,0,0,0,0,0,0,0,0,0,0,0,0,0,0,1,1,0,1,1,1
"Bosnia and Herzegovina/Yugoslavia (former)",Government/territory,125,"Bosnia peace process","Europe and Eurasia",1169,1,"Statement of Principles on Bosnia, International Conference on Former Yugoslavia (The London Conference)",1992-08-27,"Multiparty signed/agreed",3,4842,InterIntra,Pre,Prin,"This was convened by Great Britain, which held the presidency of the EC at the time. The Participants were: The SFRY republics, the EC countries, the USA, China, Russia, Japan, Canada, The Republic of Czechoslovakia (as a state which held the presidency of CSCE – Commission on Security and Cooperation in Europe) and the neighboring countries: Austria, Hungary, Romania, Bulgaria, Albania",,"Page 1, Untitled preamble
...They welcome the adoption by the United Nations Security Council of Resolution 771 and other Security Council Resolutions, and the Resolution of the UN Commission on Human Rights on the situation of human rights in the territory of the former Yugoslavia.

Page 2, 
A political settlement in Bosnia and Herzegovina must include the following provisions:
...g) assurances of non-intervention by outside military forces whether formed units or irregulars, except as provided for in relevant UN Security Council Resolutions;",BIH,,346,,389,,,215,0,0,0,0,0,0,0,0,0,0,0,0,0,0,0,0,0,0,0,0,1,1,0,0,0,0,0,0,0,0,0,0,0,0,0,0,0,0,0,0,1,1,0,0,0,0,0,0,0,0,0,0,0,0,0,0,0,1,0,0,0,0,0,1,1,1,0,0,0,0,0,0,1,0,0,0,0,0,0,0,0,0,0,0,0,0,0,0,0,0,0,0,0,0,0,0,0,0,0,0,0,0,0,0,0,1,0,1,0,0,0,0,0,3,0,0,1,0,0,0,0,0,0,0,0,0,0,0,0,0,0,0,0,0,0,0,0,0,0,0,0,0,0,0,0,0,0,0,0,0,0,0,0,0,0,0,0,0,1,1,0,0,0,0,0,0,0,0,0,0,0,1,0,1,0,0,0,1,1,0,0,0,0,0,0,0,0,0,0,0,0,0,0,0,0,0,0,0,0,0,0,1,0,1,0,0,1,1,0,0,1,1,0,0,0,0,0,0,0,0,0,0,0,0,0,0,0,0,0,0,0,0,0,0,1,1,0,1,0,1
"Bosnia and Herzegovina/Yugoslavia (former)",Government/territory,125,"Bosnia peace process","Europe and Eurasia",1170,1,"Programme of Action on Humanitarian Issues agreed between the Co-Charimen to the Conference and the Parties to the Conflict, International Conference on Yugoslavia (The London Conference)",1992-08-27,"Multiparty signed/agreed",2,6639,InterIntra,Pre,PreOth,"Radovan Karadzic; Alija Izetbegovic; Mate Boban","UN Secretary-General Boutros Boutros-Ghali was the co-chairman of the International Conference on Former Yugoslavia","Page 2, 3
In carrying out the Programme of Action, the parties to the conflict undertook to abide by the following provisions: 
...
vii) that all such action should be in accordance with the agreement with the parties reached in Geneva on 22 May under auspices of the ICRC;",BIH,,346,,389,,,215,0,0,0,0,0,0,0,0,0,0,0,0,0,0,0,0,0,0,0,0,2,0,0,1,0,0,0,0,0,0,0,0,0,0,0,0,0,0,0,0,1,0,1,0,0,0,0,0,0,0,0,0,0,0,0,0,0,0,0,0,0,0,0,0,0,0,0,0,0,0,0,0,0,0,0,0,0,0,1,0,0,0,0,0,0,0,0,0,0,0,0,0,0,0,0,0,0,0,0,0,0,0,0,0,0,0,0,0,0,0,0,0,0,1,0,0,1,0,0,0,0,0,0,0,0,0,0,0,0,0,0,0,0,0,0,0,0,0,0,0,0,0,0,0,0,0,0,0,0,0,0,1,0,0,0,0,0,0,0,0,0,0,0,0,0,0,0,0,0,1,0,3,0,1,0,0,0,0,0,0,0,0,0,0,0,0,0,0,0,0,0,0,0,0,0,0,0,0,0,0,1,0,0,0,1,0,0,0,0,0,1,0,0,0,0,0,0,0,0,0,0,0,0,0,0,0,2,0,1,0,0,0,0,0,1,0,0,0,0,1
"Bosnia and Herzegovina/Yugoslavia (former)",Government/territory,125,"Bosnia peace process","Europe and Eurasia",1164,1,"Statement of Principles, International Conference on Yugoslavia (The London Conference)",1992-08-26,"Multiparty signed/agreed",2,3547,InterIntra,Pre,Prin,"This was convened by Great Britain, which held the presidency of the EC at the time. The Participants were: The SFRY republics, the EC countries, the USA, China, Russia, Japan, Canada, The Republic of Czechoslovakia (as a state which held the presidency of CSCE – Commission on Security and Cooperation in Europe) and the neighboring countries: Austria, Hungary, Romania, Bulgaria, Albania",,"Page 1, 
(x) the obligations on all states and parties concerned to comply in full with all UN Security Council Resolutions on the crisis in the former Socialist Republic of Yugoslavia and to do their utmost to secure their implementation;",BIH,,346,,389,,,215,1,1,0,0,0,0,0,0,0,0,0,0,0,0,0,0,0,0,0,0,1,1,0,0,0,0,0,0,0,0,0,0,0,0,0,0,0,0,0,0,1,1,0,0,0,0,0,0,0,0,0,0,0,0,0,0,0,1,0,0,1,0,0,1,0,1,0,0,0,0,0,0,0,0,0,0,0,0,0,0,0,0,0,0,0,0,0,0,0,0,0,0,0,0,0,0,0,0,0,0,0,0,0,0,0,0,0,0,0,0,0,0,0,3,0,0,1,0,0,0,0,0,0,0,0,0,0,0,0,0,0,0,0,0,0,0,0,0,0,0,0,0,0,0,0,0,0,0,0,0,0,0,0,0,0,0,0,0,0,0,0,0,0,0,0,0,0,0,0,1,0,1,0,1,0,0,0,0,0,0,0,0,0,0,0,0,0,0,0,0,0,0,0,0,0,0,0,0,0,0,0,1,0,1,0,0,0,0,0,0,0,0,0,0,0,0,0,0,0,0,0,0,0,0,0,0,0,0,0,0,0,0,0,0,1,1,0,1,0,1
"Bosnia and Herzegovina/Yugoslavia (former)",Government/territory,128,"Bosnia Local peace processes","Europe and Eurasia",1608,1,Protocol,1992-08-08,"Multiparty signed/agreed",3,2522,IntraLocal,Pre,Conf,"HVO representatives: 1. Josip BORO 2. Marko FRANKOVIC 3. Vinko ANTUNOVIC 4. Josip KRISTIC
Representatives of the Muslim people: Ejob Mujic [did not sign], Senaid DURAKOVIC
","For the BH Presidency: Franjo BORAS","Page 1, III.
During further talks, both sides will in a civilised and peaceful manner and in the spirit of the Agreement on Friendship and Cooperation signed by the republics of Croatia and Bosnia and Herzegovina in Zagreb on 21 July 1992...",BIH,,346,,389,,,215,0,0,0,0,0,0,0,0,0,0,0,0,0,0,0,0,0,0,0,0,0,0,0,0,0,0,0,0,0,0,0,0,0,0,0,0,0,0,0,0,0,0,0,0,0,0,0,0,0,0,0,0,0,0,0,0,0,0,0,0,0,0,0,0,0,0,0,0,0,0,0,0,0,0,0,0,0,0,0,0,0,0,0,0,0,0,0,0,0,0,0,0,0,0,0,0,0,0,0,0,0,0,0,0,0,0,0,0,0,0,0,0,0,0,0,0,0,0,0,0,0,0,0,0,0,0,0,0,0,0,0,0,0,0,0,0,0,0,0,0,0,0,0,0,0,0,0,0,0,0,0,1,0,0,0,0,0,0,0,0,0,0,0,0,0,0,0,0,0,0,0,0,0,0,0,0,0,0,0,0,0,0,0,0,0,0,0,0,0,0,0,0,0,0,0,0,0,0,0,0,1,2,1,0,0,0,0,0,0,0,0,0,0,0,0,0,0,0,0,0,0,0,0,0,0,0,0,0,0,0,0,0,0,0,0,0,0,0,0,1
"Bosnia and Herzegovina/Yugoslavia (former)",Government/territory,125,"Bosnia peace process","Europe and Eurasia",1478,1,"Agreement on Friendship and Cooperation between the Republic of Bosnia and Herzegovina and the Republic of Croatia",1992-07-21,"Multiparty signed/agreed",2,7649,InterIntra,Imp,,"President of the Presidency of the Republic of Bosnia and Herzegovina Alija lzetbegovic; President of the Republic of Croatia Dr Franjo Tudjman  ",,"Page 1, Untitled Preamble
...Accepting the Resolutions of the United Nations Security Council No. 752 (1992) of July 15, 1991, No. 757 (1992) of May 30, 1992, No. 758 (1992) of June 8, 1992, No. 760 (1992) of June 18, 1992, No. 761 (1992) of June 29, 1992, No. 762 (1992) of June 30, 1992 and No. 764 (1992) of July 13, 1992; 

Page 1-2, 3. 
...Faced with the pressing problem of massive persecution, particularly of the Muslim and Croat population of Bosnia and Herzegovina, the Republic of Bosnia and Herzegovina and the Republic of Croatia will co-operate in providing for refugees in the Republic of Croatia and other countries, collection of humanitarian and financial aid, construction of refugee centres in safe zones in Bosnia and Herzegovina, and the return of refugees from the Republic of Croatia to the Republic of Bosnia and Herzegovina. A separated protocol on cooperation will be signed for the purpose.

Page 2, 10. 
The Governments of the two States will organize, within the shortest possible time, and as required, meetings and meetings of the ministries of the two States, in order to conclude agreements deriving from this Agreement in their sphere of competence.",BIH,,346,,389,,,215,0,0,0,0,0,0,0,0,0,0,0,0,0,0,0,0,0,0,0,0,3,1,0,1,0,0,0,0,0,0,0,0,0,0,0,0,0,0,0,0,1,1,0,0,0,0,0,0,0,0,0,0,0,0,0,0,0,1,1,1,0,0,0,1,0,0,1,0,0,0,0,0,2,0,0,0,0,0,0,0,0,0,0,0,0,0,0,0,0,0,0,0,0,0,0,0,0,0,0,0,2,1,1,0,0,0,1,0,1,0,0,0,1,0,0,0,0,0,0,0,0,0,0,0,0,0,0,0,0,0,0,0,0,0,0,0,0,0,0,0,0,0,0,0,0,0,0,0,0,0,0,0,0,0,0,0,0,0,2,1,1,1,0,0,0,0,0,0,0,0,0,1,0,1,0,0,0,0,0,0,0,0,0,0,0,0,0,0,0,0,0,0,0,0,0,0,0,0,1,1,0,0,0,0,0,2,0,0,0,0,1,0,0,0,0,0,0,0,0,0,0,0,0,0,0,0,0,0,0,0,0,0,0,0,0,0,0,0,0,1
"Bosnia and Herzegovina/Yugoslavia (former)",Government/territory,125,"Bosnia peace process","Europe and Eurasia",1477,1,"Text of the agreement signed at London on 17 July 1992 by Mr. Boban, Dr. Karadzic and Dr. Silajdzic",1992-07-17,"Multiparty signed/agreed",1,1378,Intra,Cea,Ceas,"Mr. Boban; Dr. Karadzic; Dr. Silajdzic",,,BIH,,346,,389,,,215,0,0,0,0,0,0,0,0,0,0,0,0,0,0,0,0,0,0,0,0,0,0,0,0,0,0,0,0,0,0,0,0,0,0,0,0,0,0,0,0,1,1,0,0,0,0,0,0,0,0,0,0,0,0,0,0,0,0,0,0,0,0,0,0,0,0,0,0,0,0,0,0,1,0,0,0,0,0,0,0,0,0,0,0,0,0,0,0,0,0,0,0,0,0,0,0,0,0,0,0,0,0,0,0,0,0,0,0,0,0,0,0,0,0,0,0,0,0,0,0,0,0,0,0,0,0,0,0,0,0,0,0,0,0,0,0,0,0,0,0,0,0,0,0,0,0,0,0,0,0,0,1,0,0,0,0,0,0,0,0,0,0,0,0,0,0,0,0,0,0,0,0,0,0,0,0,0,0,0,0,0,0,0,0,0,0,0,0,0,0,0,0,0,0,0,0,0,0,0,0,0,2,1,0,0,0,0,0,0,0,0,0,0,0,0,0,0,0,0,0,0,0,0,0,0,0,0,0,0,0,0,0,0,0,0,0,0,1,0,1
"Bosnia and Herzegovina/Yugoslavia (former)",Government/territory,125,"Bosnia peace process","Europe and Eurasia",1476,1,"Joint Statement",1992-07-08,"Agreement with subsequent status",2,3003,InterIntra,Pre,PreOth,"President of the Presidency of the Republic of Bosnia and Herzegovina, Mr. Alija Izetbegovic; President of the Republic of Croatia, Dr. Franjo Tudjman","Ministers of Foreign Affairs Dr. Haris Silajdzic and Prof. Dr. Zdenko Skrabalo, the Head of the Office of the President of the Republic of Croatia Mr. Hrvoje Sarinic, and the Foreign Policy Adviser of the President",,BIH,,346,,389,,,215,0,0,0,0,0,0,0,0,0,0,0,0,0,0,0,0,0,0,0,0,1,1,0,0,0,0,0,0,0,0,0,0,0,0,0,0,0,0,0,0,1,1,0,0,0,0,0,0,0,0,0,0,0,0,0,0,0,1,1,0,0,0,0,1,0,0,0,0,0,0,0,0,0,0,0,0,0,0,0,0,0,0,0,0,0,0,0,0,0,0,0,0,0,0,0,0,0,0,0,0,0,0,0,0,0,0,1,1,0,0,0,0,0,1,0,0,1,0,0,0,0,0,0,0,0,0,0,0,0,0,0,0,0,0,0,0,0,0,0,0,0,0,0,0,0,0,0,0,0,0,0,0,0,0,0,0,0,0,1,1,0,0,0,0,0,0,0,0,0,0,0,1,0,1,0,0,0,0,0,0,0,0,0,0,0,0,0,0,0,0,0,0,0,0,0,0,0,0,0,0,0,0,0,0,0,0,0,0,0,0,1,0,0,0,0,0,0,0,0,0,0,0,0,0,0,0,0,0,0,0,0,0,0,0,0,0,0,0,0,1
"Bosnia and Herzegovina/Yugoslavia (former)",Government/territory,125,"Bosnia peace process","Europe and Eurasia",1607,1,"Agreement on mutual release of the prisoners along the line “all for all”",1992-07-05,"Multiparty signed/agreed",2,1807,Intra,Pre,Conf,"President of the Exchange Commission, Nenad VANOVAC; For UNPROPOR, B. KELLY; President of the Exchange Commission, Filip VUKOVIC
",,"Page 1, 
Based on Agreement concluded on 5 July 1992, authorised representatives of the Commissions for exchange of the war prisoners accept AGREEMENT on mutual release of the prisoners along the line ""all for all""...",BIH,,346,,389,,,215,0,0,0,0,0,0,0,0,0,0,0,0,0,0,0,0,0,0,0,0,0,0,0,0,0,0,0,0,0,0,0,0,0,0,0,0,0,0,0,0,0,0,0,0,0,0,0,0,0,0,0,0,0,0,0,0,0,0,0,0,0,0,0,0,0,0,0,0,0,0,0,0,0,0,0,0,0,0,0,0,0,0,0,0,0,0,0,0,0,0,0,0,0,0,0,0,0,0,0,0,0,0,0,0,0,0,0,0,0,0,0,0,0,0,0,0,0,0,0,0,0,0,0,0,0,0,0,0,0,0,0,0,0,0,0,0,0,0,0,0,0,0,0,0,0,0,0,0,0,0,0,0,0,0,0,0,0,0,0,0,0,0,0,0,0,0,0,0,0,0,0,0,0,0,0,0,0,0,0,0,0,0,0,0,0,0,0,0,0,0,0,0,0,0,0,0,0,0,0,0,0,0,0,0,0,0,0,0,0,0,0,0,0,0,0,0,0,0,0,0,0,0,0,0,0,0,3,0,0,2,0,0,0,0,0,0,0,1,1,1
"Bosnia and Herzegovina/Yugoslavia (former)",Government/territory,125,"Bosnia peace process","Europe and Eurasia",1570,1,"Joint Statement",1992-06-15,"Multiparty signed/agreed",2,3307,InterIntra,Pre,PreOth,"President of the Republic of Croatia DR FRANJO TUDJMAN; President of the Presidency of the Republic of Bosnia and Herzegovina ALIJA IZETBEGOVIC",,,BIH,,346,,389,,,215,0,0,0,0,0,0,0,0,0,0,0,0,0,0,0,0,0,0,0,0,0,0,0,0,0,0,0,0,0,0,0,0,0,0,0,0,0,0,0,0,1,1,0,0,0,0,0,0,0,0,0,0,0,0,0,0,0,1,0,1,0,0,0,1,0,0,0,0,0,0,0,0,0,0,0,0,0,0,0,0,0,0,0,0,0,0,0,0,0,0,0,0,0,0,0,0,0,0,0,0,0,0,0,0,0,0,0,0,0,0,0,0,0,0,0,0,0,0,0,0,0,0,0,0,0,0,0,0,0,0,0,0,0,0,0,0,0,0,0,0,0,0,0,0,0,0,0,0,0,0,0,0,0,0,0,0,0,0,0,0,0,0,0,0,0,0,0,0,0,0,0,1,0,1,0,0,0,0,0,0,0,0,0,0,0,0,0,0,0,0,0,0,0,0,0,0,0,0,0,0,0,0,0,0,0,0,0,0,0,0,0,0,0,0,0,0,0,0,0,0,0,0,0,0,0,0,0,0,0,0,0,0,0,0,0,0,0,0,0,1
"Bosnia and Herzegovina/Yugoslavia (former)",Government/territory,125,"Bosnia peace process","Europe and Eurasia",1589,1,"Agreement (ICRC Humanitarian Principles)",1992-06-06,"Multiparty signed/agreed",8,16591,Intra,Pre,PreOth,"Mr. K. Trnko, Representative of Mr Alija IZETBEGOVIC, President of the Republic of Bosnia and Herzegovina
Mr. D. Kalinic, Representative of Mr. Radovan KARADZIC, President of the Serbian Democratic Party
Mr. S. Sito Coric, Representative of Mr. Miljenko BRKIC, President of the Croatian Democratic Union
Mr. I. Sarac, Liaison Officer of the Croatian Democratic Union

Mr. A. KURJAK, Representative of the President of the Party of Democratic Action, who could not attend the meeting, has been invited to ratify the present agreement, and has done so on … [page in English, with signatures]","At a meeting opened by Mr. Cornelio Sommaruga, President of the International Committee of the Red Cross, and chaired by Mr. Thierry Germond, the General Delegate of the ICRC for Europe. The following attended the meeting as observers:
On behalf of the Federal Republic of Yugoslavia, His Excellency, Mr. Naste Calovski, Ambassador, Colonel General V. Vojvodic
On behalf of the Republic of Croatia: Dr. I. Simonovic
On behalf of the United Nations High Commission for Refugees: Mrs. A. M. Demmer, Director, Regional Office for Europe and America, Mr. J. M. Mendiluce, High Commission Special Envoy.","Page 2, Untitled preamble
Pursuant to Agreement no. 1 signed by the representatives of the Parties on 22 May 1992 in Geneva, and in keeping with its humanitarian mandate, ICRC hereby presents its plan of action, which includes a number of guidelines.

Page 3, II. Security requirements related to implementation of the lCRC plan of activities, 7.
Ensure that the emblem of the Red Cross is respected in keeping with Article 3 of Agreement no. 1 signed on 22 May 1992 in Geneva.

Page 3, II. Security requirements related to implementation of the lCRC plan of activities, 10.
Do your utmost to ensure that the principles and regulations of international humanitarian law, especially Agreement no. 1 of 22 May 1992, are known to all the soldiers and the civilian population.

Page 4,  III. ICRC Aid Programme, I. Beneficiaries and types of aid, 2. Medical programme, b) Evacuations
Measures will be taken to enable the evacuation of the wounded, the sick and other vulnerable persons in keeping with the relevant provisions set forth in Agreement no.1 of 22 May 1992.

Page 4,  III. ICRC Aid Programme, I. Beneficiaries and types of aid, 3. Logistical and operational structure
Approach: Pursuant to Article 2(6) of Agreement no. 1 signed on 22 May 1992 in Geneva, the parties will allow unimpeded passage of all shipments of medicine and medical supplies, necessary foodstuffs and clothing intended exclusively for the civilian population...

Page 6,  III. ICRC Aid Programme, I. Beneficiaries and types of aid, 5. Other ICRC activities
...The ICRC wishes to remind the parties that item 2.4 of Agreement no. 1 signed on 22 May 1992 in Geneva stipulates the following: ""Imprisoned soldiers will receive the treatment envisaged by the Third Geneva Convention. The International Committee of the Red Cross (ICRC) will have free access to all imprisoned soldiers in order to fulfil its humanitarian mandate pursuant to the Third Geneva Convention adopted on 12 August 1949.""... ",BIH,,346,,389,,,215,0,0,0,0,0,0,0,0,0,0,0,0,0,0,0,0,0,0,0,0,0,0,0,0,0,0,0,0,0,0,0,0,0,0,0,0,0,0,0,0,3,0,1,0,0,0,0,0,0,0,0,0,0,0,0,0,1,0,0,0,0,0,0,0,0,0,0,0,0,0,0,0,0,0,0,0,0,0,1,0,0,0,0,0,0,0,0,0,0,0,0,0,0,0,0,0,0,0,0,0,0,0,0,0,0,0,0,0,0,0,0,0,0,1,0,0,1,0,0,0,0,0,0,0,0,0,0,0,0,0,0,0,0,0,0,0,0,0,0,0,0,0,0,0,0,0,0,0,0,0,0,1,0,2,0,1,0,0,0,0,0,0,0,0,0,0,0,0,0,1,0,3,0,1,0,0,0,0,0,0,0,0,0,0,0,0,0,0,0,0,0,0,0,0,0,0,0,0,0,0,0,2,1,0,0,0,0,0,0,0,0,0,0,0,0,0,0,0,0,0,0,0,0,0,0,0,1,0,2,0,0,0,0,0,0,0,0,0,0,1
"Bosnia and Herzegovina/Yugoslavia (former)",Government/territory,125,"Bosnia peace process","Europe and Eurasia",1022,1,"Agreement of 5 June 1992 on the reopening of the Sarajevo Airport for humanitarian purposes",1992-06-05,"Multiparty signed/agreed",2,3686,Intra,Pre,PreOth,"Members of Bosnian Presidency, signed separately by Radovan Karadzic
For UNPROFOR: Cedric Thornberry",,"Page 1, 
As a first step towards tbe implementation of Security Council resolution 757 (1992), paraqraph 17; ",BIH,,346,,389,,,215,0,0,0,0,0,0,0,0,0,0,0,0,0,0,0,0,0,0,0,0,0,0,0,0,0,0,0,0,0,0,0,0,0,0,0,0,0,0,0,0,0,0,0,0,0,0,0,0,0,0,0,0,0,0,0,0,0,0,0,0,0,0,0,0,0,0,0,0,0,0,0,0,1,0,0,0,0,0,0,0,0,0,0,0,0,0,0,0,0,0,0,0,0,0,0,0,0,0,0,0,0,0,0,0,0,0,1,0,0,0,0,0,0,0,0,0,0,0,0,0,0,0,0,0,0,0,0,0,0,0,0,0,0,0,0,0,0,0,0,0,0,0,0,0,0,0,0,0,0,0,0,1,0,0,0,0,0,0,0,0,0,0,0,0,0,0,0,0,0,0,0,1,0,1,0,0,0,0,0,0,0,0,0,0,0,0,0,0,0,0,0,0,0,0,0,0,0,0,0,0,1,2,1,0,0,0,0,0,0,0,0,0,0,0,0,0,0,0,0,0,0,0,0,0,0,0,0,0,0,0,0,0,0,0,1,0,0,1,0,1
"Bosnia and Herzegovina/Yugoslavia (former)",Government/territory,125,"Bosnia peace process","Europe and Eurasia",1590,1,"Agreement by the Serbian Republic of Bosnia and Hercegovina with regard to the opening of Sarajevo airport",1992-06-01,"Unilateral document",2,3875,Intra,Cea,Rel,"On behalf of the Serbian Republic of Bosnia Herzegovina: Dr Nikola Koljevic, Member of the Presidency of Serbian Republic of Bosnia and Herzegovina; Signed on behalf of UNPROFOR by Lt. Col R.P. Gray  ",,,BIH,,346,,389,,,215,0,0,0,0,0,0,0,0,0,0,0,0,0,0,0,0,0,0,0,0,0,0,0,0,0,0,0,0,0,0,0,0,0,0,0,0,0,0,0,0,0,0,0,0,0,0,0,0,0,0,0,0,0,0,0,0,0,0,0,0,0,0,0,0,0,0,0,0,0,0,0,0,0,0,0,0,0,0,0,0,0,0,0,0,0,0,0,0,0,0,0,0,0,0,0,0,0,0,0,0,0,0,0,0,0,0,0,0,0,0,0,0,0,0,0,0,0,0,0,0,0,0,0,0,0,0,0,0,0,0,0,0,0,0,0,0,0,0,0,0,0,0,0,0,0,0,0,0,0,0,0,0,0,0,0,0,0,0,0,0,0,0,0,0,0,0,0,0,0,0,0,0,0,0,0,0,0,0,0,0,0,0,0,0,0,0,0,0,0,0,0,0,0,0,0,0,0,0,0,0,1,2,1,0,0,0,0,0,0,0,1,0,0,0,0,0,0,0,0,0,0,0,0,0,0,0,0,0,0,0,0,0,0,0,1,0,0,1,0,1
"Bosnia and Herzegovina/Yugoslavia (former)",Government/territory,125,"Bosnia peace process","Europe and Eurasia",1591,1,"Agreement by the Republic of Bosnia Herzegovina with regard to the Concentration of all Heavy Weapons in and Around Sarajevo",1992-06-01,"Status unclear",2,3538,Intra,Cea,Rel,"On behalf of the President of the Republic of Bosnia Herzegovina: Colonel Stjepan Siber, Member of the Republic of Bosnia and Herzegovina [unclear if signed]
Signed on the behalf of UNPROFOR by Lt Col R.P Gray [unclear if signed]
",,,BIH,,346,,389,,,215,0,0,0,0,0,0,0,0,0,0,0,0,0,0,0,0,0,0,0,0,0,0,0,0,0,0,0,0,0,0,0,0,0,0,0,0,0,0,0,0,0,0,0,0,0,0,0,0,0,0,0,0,0,0,0,0,0,0,0,0,0,0,0,0,0,0,0,0,0,0,0,0,0,0,0,0,0,0,0,0,0,0,0,0,0,0,0,0,0,0,0,0,0,0,0,0,0,0,0,0,0,0,0,0,0,0,0,0,0,0,0,0,0,0,0,0,0,0,0,0,0,0,0,0,0,0,0,0,0,0,0,0,0,0,0,0,0,0,0,0,0,0,0,0,0,0,0,0,0,0,0,0,0,0,0,0,0,0,0,0,0,0,0,0,0,0,0,0,0,0,0,0,0,0,0,0,0,0,0,0,0,0,0,0,0,0,0,0,0,0,0,0,0,0,0,0,0,0,0,0,1,2,1,0,0,0,0,0,0,0,0,0,0,0,0,0,0,0,0,0,0,0,0,0,0,0,0,0,0,0,0,0,0,0,1,0,0,1,0,1
